review_title,review_body,rating,review_date
Fascinating story of political ambition and eventual disenchantment.,"I really enjoyed ""The Candidate"" film. I'm not aware of every Robert Redford film but he is very good in this one. The story follows the political campaign of a man who wants to be elected the senator of California. As the character in question, Robert Redford is a Democratic as opposed to his opponent who is a Republican (Don Porter). The inital attempts to win the election aren't very successful, until Redford realises that he can't succeed on his own terms. Eventually, he experiences disenchantment by having to sacrifice his own principles for the sake of winning the election. I won't reveal anything about the ending but you have to see it in order to understand it. The writing is very good and it makes a refreshing change to see an American film from this era that is more thought-provoking than ones that are just violent. I enjoyed the scene with the political television debate, it becomes a bit heated at one stage!",8.0,26 June 2017
****,,10.0,20 July 2015
Excellent dry humor political satire that belongs up there with the greats,"What do Network, The Graduate, Chinatown, and The Candidate all have in common? Besides using an LA hotel as a set piece at least once, these 70s condemnations of corruption in both the news media and on Capitol Hill all give moments where mouthpieces for authenticity are chewed up and spat out by the overlords in control of them and end with scenes of the protagonist being told an ""It's Chinatown, Jake"" level quote by characters who have been around the block more than they have, and end with powerful final shots of characters looking listlessly into the distance radiating ""What do we do now"" energy. Bonus if the protagonist is a heartthrob who has an affair, drives back and forth California a lot, is almost done in by LA water shenanigans.

The Candidate combines the best aspects of all these movies to show the ugly of the most stately people, in a dryer than the LA river deadpan satire that effectively captures this period in 70s Cali in an almost documentarian fashion in a beautifully cinemotographed feature. The scene that uses the mic interference to get across his disorientation is 10/10 sound design.

It kept me entertained while being in its commitment to its satirical bit, only dropping the mask ever so slightly in the scene of McKay rehearsing his A Better Way speech in the car in a movie that almost bludgeons the audience with its irony.

Overall I am satisfied with how the movie progressed given the potential to really screw the pooch if it didn't know what it wanted to say about the corrupting influence of politics and how to do so uniquely and in a way that's worth watching. Fabulously acted Senator Jarmon in particular really perfected the monotone politician voice and Robert Redford was made for the role of well intentioned golden boy governors son public servant who loses his way.",,17 June 2021
Solid behind-the-scenes look at a political campaign,"Great look at a political campaign that remains timely despite it's age. Redford is good as the young, glamour-boy candidate, but Peter Boyle carries the movie as his campaign manager. Boyle's performance is Oscar-quality, one of my favorites of all-time. Look for Natalie Wood in a cameo, she's never looked better.",9.0,12 October 1999
This is the best interpretation of the history of cinema of political life,,10.0,25 December 2021
"By moving slow, the films intimacy grows","I was drawn to The Candidate because of two prior viewings: All the Presidents Men and The Conversation. The former features Robert Redford and is arguably one of the greatest films of all time. The latter is a hidden gem (and hard to buy/view) but captures the brilliance of Allen Garfield. Both excel here.

The plot is predictable from the title, the delivery less so.

The film meanders at a walking pace and is without any real climaxes. This isn't a weakness per se as it allows you to appreciate the sheer quality of the acting. A political campaign is full of repetition - quoting the same sound bites, greeting the same people - and this film captures that in a way that allows you to grow a fondness of characters you disliked from the beginning. You grow into the movie as the Candidate himself grows into a contender.

That's the films masterstroke: slowing the pace to grow the intimacy.

Final word to Robert Redford himself. Without offering spoilers, there are scenes here where you don't know if they are outtakes or actual acting - and if the former, they it fools you as the latter. He is so in control of his role as Bill McKay you feel like you're a fly on the wall on the actual campaign trail. Non-fiction might be a suitable categorisation as The Candidate feels that close to the truth.",9.0,17 March 2024
Finessing the Down and Dirty,"Cynical young Bill McKay is encouraged to follow his father into politics by running for the Senate against smooth longtime incumbent Jarmon. Against his better judgment, the handsome McKay reluctantly complies.

All in all, the movie shows the road to corruption without the corruption. True, we see McKay (Redford) drawn into the momentum of his Senate campaign under pressures of a large and harried staff. We know his early ideals are being slowly overridden, but crucially we never see the backroom deals that seal a fall from grace. We do see deal-maker Starkey (Tobey) meeting the candidate at a crucial election stage, but what exactly is understood between them is left unseen. Thus this inside look at our political process shows the colorful pomp but without the fateful circumstance.

And show the political spectacle, the movie does, in spades. I don't know how they did the many crowd and rally scenes, but the numbers and enthusiasm are convincing as heck. It's an excellently produced and directed effort.

Redford low-keys it all the way through. As the candidate, he's hardly the effusive glad-hander, but then, with his youthful good looks, he doesn't need to be. It's really Peter Boyle as the savvy campaign manager who projects. We also get a good look at the hectic pace and foul-ups that big time campaigns are subject to. Thus, it's no wonder that McKay slowly succumbs to the pressures of the contest that yield the movie's famous last line.

However, as a down and dirty look at the deal-making so crucial to electoral success, the movie only implies but doesn't show. Instead, focus is limited to McKay's ""selling out"", despite what he knows about the dirty business and his own better instincts. Thus the upshot amounts to the graphic undoing of one man but not of the process as a whole. Still, it's a very watchable production with lessons even for today.",,16 November 2015
Frighteningly topical,"The great American tragedy - a man of great integrity, who knows precisely what ethical dangers await one in elected office, sets forth to commit goodness, but in the end becomes -- a politician.

A tremendous insightful film when first released, seen now just on the other side of Bulworth's ""threshold of a new millenium,"" one finds that the only changes after nearly thirty years are sideburn lengths and width of ties.",10.0,20 June 2000
"Ahead of its time, behind ours","Excellent movie that shows campaign politics fifty years ago. Redford jumped into character with gusto and made the movie worth watching all by himself. He is one of very few actors that could turn on the charm to JFK levels. Peter Boyle played the campaign manager in a way that must have been a revelation in its day. Don Porter played a Reagan era oponent competently, and that is the catch. Move forward fifty years and all the cynicism of Porter, and Redford too, turns quaint. In such a short time the whole political business has turned upside down, from cynic to grotesque. This movie could be remade and it could turn into a great movie; there is so much new material.",8.0,15 July 2023
More election-year left-wing propaganda rubbish with Redford.,,,8 January 2007
Shallow and pointless,"This film tries to show how pointless and shallow politics is, by being pointless and shallow. It's amusing to see how nothing has changed in thirty years. But don't waste two hours on this film. Redford does better as a director than as an actor.",,17 February 2002
Robert Redford's First Out Of Character Film Results In Another Success,Robert Redford first tried to establish himself as a serious actor with his role as a lawyer who pursues a run for a senate office in this 1972 Warner Brothers release. He succeeds yet again even when he goes almost completely out of character. There's some comedy here but it's mostly a dramatic show as Redford's character gradually learns how politics really work. A career highlight that would serve as a basis for Redford's later dramatic successes.,,6 November 2002
Robert Redford excels in this political comedy,"Bill Mccay is prepositioned by a political analyst to stand against a Republican elective who is such a sure-shot guarantee that other established democrats are refusing to run against him. Mccay being young, handsome and idealistic is chosen to lessen the blow according to the analyst. Mccay enters the challenge hoping to impart his message to the masses- regardless of the outcome. Unfortunately, he is found to be too good and ends up winning the election. This is a great comedy drama in the political realm and Robert Redford is excellent as the handsome idealistic Mccay. The film has garnered much acclaim since release and if you enjoy a good political movie then the Candidate is a fine choice.",,26 July 2018
"Well-made, and more or less informative","A fine film about a young lawyer (Robert Redford) running for the senate, encouraged by an old college-friend-turned-campaign-manager (Peter Boyle). Redford is assured by him that he will lose against the Republican incumbent and that he can therefore be as honest as he wants in the campaign. As his popularity increases, however, and it looks as though he may in fact win, his managers are far more careful about what they will and will not allow him to say on the issues of the day.

The Candidate is very well made, with an excellent screenplay and supporting cast (particularly Allen Garfield as Redford's ad man and Melvyn Douglas as Redford's dad, a former governor of the state), but, probably because of Redford's own political views, the film doesn't go as far as it could in showing the corruption rampant in party politics. There is one scene in which Redford has a run-in with a Teamster boss, but it remains unresolved, and in the next scene Redford is more or less back to his old idealism. We know something happened, but we have no idea what.

Despite this, The Candidate is highly recommended.

Watch for familiar faces, including Senator Hubert Humphrey.",,25 March 2000
