review_title,review_body,rating,review_date
Solid Prequel to a Classic,"This was a movie that when I saw was coming out, I was intrigued. I'm not the biggest fan of prequels, because they have a definite ending that they must do or it doesn't work. Ahead of seeing this, I saw people were loving it. I did sit on this before writing my review to make sure that I was being fair.

Synopsis: a young American woman is sent to Rome to begin her life of service to the church but meets a darkness that causes her to question her faith and uncovers a terrifying conspiracy that hopes to bring about the evil incarnate.

We start this with Father Harris (Charles Dance) meeting Father Brennan (Ralph Ineson). There is an ominous way of filming the opening that harkens back to the original. It appears that these two have uncovered a plot that involves a young woman named Scianna. Their information is limited though. We also see that there are dark forces trying to stop them.

That is when we shift over to meeting the woman from the synopsis, Margaret (Nell Tiger Free). She has come to Rome to become a nun at an orphanage. She is met by Father Gabriel (Tawfeek Barhom) who then takes her to Cardinal Lawrence (Bill Nighy). These two met when she was a child. He is the reason that she has come to Rome to take her vows. She looks at him as a father figure.

She arrives at the orphanage and is given a lay of the land by Sister Silva (Sonia Braga). It is during this tour that we see that this place also has a wing to help expecting mothers. During this tour that she meets an odd nun, Sister Anjelica (Ishtar Currie-Wilson). She also meets a young woman who is isolated, Carlita Scianna (Nicole Sorace). Margaret is staying in an apartment with Luz (Maria Caballero), before they both take their vows. It is off the orphanage grounds.

Something I should include here is that this takes place in the early 1970s. There is unrest in Rome as the younger generation is turning their backs on religion. They are also rioting. What is interesting is that this is based in fact. This makes Margaret uneasy. She also doesn't like the way that Carlita is treated by the sisters. Then to complicate her time further, Luz takes her out. She gets drunk, blacks out and doesn't remember what happened. Father Brennan also approaches her, wanting her to help him uncover the truth of the orphanage she is working at.

That is where I'll leave my recap and introduction to the characters. Where I want to start is that I'm a big fan of the original movie in the series. It is up there as one of the best religious based horror films in my opinion. The second one is a good follow up and I thought the third did interesting things. I don't even hate the fourth movie even though it was made for TV. It is just the remake that I feel doesn't hold up. This is information that I felt important before diving into this one.

Where I'll start then is continuity. I'm glad that this one doesn't do anything to violate what the original or the sequels did. It synced up well, which is what I'm looking for. In a group chat that I'm in, it might even tie into part four, but it's been a while since my last viewing of that one and I don't remember a lot. This shouldn't come as a spoiler, but I thought that this one did well to show how Damien was conceived and then ended up in the care of the Thorns.

I'll even credit this one as being creepy at times. I'm a sucker for religious based horror, especially when we're looking at the corruption of the church. That is what we're getting here. It is wild that this came out the same year as Immaculate as we're following similar stories. They just end up in different places. I'm not fully sure that the plan of our villain makes sense here. It could do what they want, but it also could spell the end of the world. I see the logic being that as they're so convinced that no matter what, good will triumph. Just seems a dangerous move to play. It also lessens what the movies that follow and their story concept. I will still say that this does give a solid atmosphere. Messing with Margert, who has a history of mental illness. We can see that logically; she could be misinterpreting things. I like playing with this idea.

Now I've seen people rating this high and heaping praise. I can't do that though. My biggest issue is that this borrows from other movies that do it better. This directly takes the shocking moments from The Omen and uses them here. I can't credit this movie for that. I get the idea that this is banking on younger audiences not having seen that. There is also a big plot point that is from Rosemary's Baby which is one of my favorite movies of all time. It also takes its most shocking moment from Possession.

Since I went hard there, let me go over to filmmaking. I still think is well-made. The cinematography was good. I like how they frame things, even if they're nodding to the original. Setting up this where we have Margaret who is a fish out of water is good. She doesn't speak the language so that's scary. On top of that, she has the history of mental illness. I like how we don't know if we can trust her. I think that the effects for the most part are good. It looked like they went practically where they could. There was CGI used which was fine as well. Other than that, I was bummed that we didn't use more of the chanting or choir style music from the original. It does at a pivotal point that worked though. The sound design was good though.

All that is left is acting. I thought that Free was good as our lead. She can balance that maybe she isn't crazy, but we have history and facts that contradict that. I also thought she showed good fear. It doesn't help that she is taking on the higher ups at this orphanage, when she is new which is stressful too. Ineson is solid as our priest who is out to prove what is happening. His performance matches up with that character from the original from what I remember. Braga is good as our head nun. We should trust her, but we don't know if we can. I like Barhom and Caballero in their roles. What I like there is that as things go on, we don't know who we can trust. I'd also say that Dance, Nighy, Sorace, Currie-Wilson, Andrea Arcangeli and the rest of the cast worked for what was needed.

In conclusion, I thought this was a solid prequel. My issue with movies like this is more that they tend to feel predictable to me. What they do here story wise is good. It fills in what we know from the original. It also incorporates elements from the sequels. The acting was good across the board. This was made well enough. The biggest issue that I have is that it borrows major scenes from other movies that I personally think did it better, including the first movie in this franchise. Another gripe is that this runs too long. Getting it down to at least one hour and forty-minute minutes, but preferably 90 minutes would help. I'd still recommend giving it a viewing, especially if you like the series.

My Rating: 7 out of 10.",7.0,22 April 2024
Surprisingly good prequel!,The movie definitely exceeded my expectations. I went to see it in theaters with my husband and was so glad we did. It has a decent amount of jump scares but doesn't overdo it. I got slightly confused nearing the end of the movie but the plot became clearer as it furthered along (maybe I'm just slow). I also really enjoyed the acting and I'm all for gore! The score is creepy as hell and the scenery is beautiful. Although I do LOVE the original Omen from the 70's I'd be very interested in another remake from this Director and writing team. I believe that this movie overall was very well made and I really enjoyed watching it.,8.0,5 June 2024
An effective prequel!,"The movie faithfully follows (pun intended) the trajectory of 'Nunsploitation', a new 'trend' in the horror realm which has been gaining momentum for quite some time now.

It particularly brought to mind Michael Mohan's recent directorial ""Immaculate"", which I had the opportunity to watch and review just a month ago.

Both films share similar themes and treatments, with the main difference being that this one is part of a well-established franchise.

As a result, it not only had to work on its own as a standalone feature but also had this daunting task of serving as a 'prequel' to the first entry released way back in 1976.

And I must admit, it succeeded on both grounds.

The movie boasts solid writing, aided by a tight screenplay and impressive technical expertise, helped to set the mood and tone effortlessly.

My only complaint is that the supporting cast does not offer much, at least from a writing perspective. The burden of storytelling falls heavily on the shoulders of the protagonist, Margaret (played commendably by Nell)

With a bit more emphasis put on developing the supporting characters, it could have become something truly special, something worth remembering.",7.0,3 June 2024
So bad I'm mad at it,"Went to the theater today and was expecting a good creepy ick. Well not this time, sister. The first half was trying to build up a story by switching from obvious foreshadowing and bits of history. The history went nowhere and the foreshadowing didn't either. Ok so the second half was just a monkey throwing poo at a script. Really, it's as if the writers were brainstorming scenes for the movie and then said well let's just film some of those and stick them in the movie...nobody will notice there's no story or reason for them to be happening. This was the biggest pile of empty movie carcasses to hit the screen since Cats. Rotted.",2.0,6 April 2024
by FAR the best horror movie I have seen in YEARS,"This is a truly brilliant, genre-bending piece of cinema. We have all been scarred by the countless poorly done remakes and sequels Hollywood has churned out over the years, but The First Omen is absolutely not part of that camp. It could honestly standalone as a fantastic horror film independent of it's parent-franchise.

If you are a fan of stunning cinematography, incredible acting and truly terrifying stories, then you NEED to see this movie.

Nell Tiger Free is absolutely incredible as the film's protagonist, and she deserves to be a huge star after this movie. She has got such star quality and likability and will honestly break your heart in some of the more harrowing scenes.

The supporting cast are also excellent. A must see movie!",10.0,5 April 2024
"The Omen prequel that's great, for the most part. [+68%]","Two nun-horror films were released a couple of weeks apart, with more or less the same plot structure. Is this a case of a one-line idea (co-incidentally) navigating the minds of several screenwriters or straight-up idea theft? We'll never know. I'm reminded of a storyline theft issue in the Malayalam industry earlier in May that made headlines. On the bright side, at least Hollywood seems chill about it (or are they?). If it's pure coincidence, then color me intrigued. Because, Immaculate and The First Omen follow the same ""plot structure"" (not plot). Michael Mohan's film had its merits and flaws, and that's the case with Arkasha Stevenson's too.

The First Omen is a better-looking film visually. It probably has a lot to do with Arkasha getting to work with a $30 mn budget as opposed to Mohan's $9 mn. This is evident from the very first scene - a heady reminder that it's a prequel to one of the most iconic horror movies of all time. Nell Tiger Free's got an incredibly expressive face, and that's a definite tickmark for a horror film protagonist. Novitiate Margaret arrives at an orphanage for girls in Rome, as clueless and excited as anyone that age would be. There are early signs of things going awry, but director Arkasha saves the most startling stuff for the film's second act.

That's also when it proudly bears its ""prequel to The Omen"" stamp, treating us to ghastly imagery (for sure, will stay in your head for a fairly long time). The film, by nature, has a lot to do with female body horror; therefore, the way the makers execute a particularly disturbing birth scene is worthy of applause. I completely enjoyed some of Arkasha's shot choices, and it's exactly the lighting, the camera positioning, the color palette, and the quick cuts that make it a thrillingly engaging ride (for the most part). The gothic-styled costumes were also an add-on. On the flip side, I didn't find the climax (and the epilogue) all that impressive (which is where Immaculate scored better IMO). It was honestly a writing (and not a performative) mess, until.. until.. until that Damien name-drop. I'd watch a sequel if Free and Arkasha return as the lead and the director, respectively.",7.0,31 May 2024
Completely Unnecessary Film,"This, although I'm sure, was well intentioned it was completely unneeded to the lore of the first film and book. There was plenty of ways to create a ""prequel"" without genuinely ruining the story that follows it. I'm not sure if it the 'short attention span' that modern film goers require that caused this story to be filmed as it was. There is a reason the original story and movie are listed as thrillers and not just flat out horror films but this missed the label by being some sort of splatter gore film.

It's sad that the classic original story won't be near as impressive to someone seeing it the first time if they've watched 'The First Omen' before it.",4.0,2 June 2024
A well deserved addition to the franchise...!!!,,7.0,29 May 2024
Continuity Continuity Continuity...,"How can I say anything about the continuity in The First Omen without including any spoilers? Well here goes...

The very concept of a prequel relies on the original that it's meant to precede. So how come this one makes such a massive error? An error that's so big you have to question whether the writers had even seen the original.

I'm not going to give details since this would definitely qualify as a spoiler but I'll explain why I've still given it 7/10. It's simply because if this was a stand-alone film then I would've rated it even higher since there's little else I would criticize aside from continuity.

Unfortunately it's not a stand-alone film and for this very reason I re-watched the 1976 original beforehand to get me in the mood. This prompted a lot of speculation regarding what could be included in this prequel. No spoilers here.

There are several key narrative constructs in the original that I would've liked to have seen developed. Some of these can be overlooked but there's a big one that's omission is inexcusable. (If you have to know then there's plenty of reviews, with spoilers, that will feed your curiosity.)

Despite the divided opinions relating to the prequels Rogue One and The Thing (2011) I was very impressed by the continuity in both. Sadly this is where The First Omen fails, ultimately amounting to an unfortunate missed opportunity.",7.0,19 April 2024
Thin fare for diehard Satanists,"After a gory opening with a two-minute cameo from Charles Dance, the movie slips into a low gear for half-an-hour or more before the Revelations start to kick in to make it an over-ripe prelude to the OMEN originals. Bill Nighy looks very uncomfortable in his role as a cardinal who may or may not be fully protective of our heroine; in one early scene I thought his lines were being dubbed, God knows why.

There's a garish glamour to the whole show that calls Dario Argento to mind. There are some welcome nods to the Gregory Peck OMEN, but the link to that movie at the end of this one is clumsy and seems to leave open the possibility that THE FIRST OMEN will not be the Last Omen. A prequel with a sequel - not sure that's a good idea. Sadly, Bill Nighy does not bring anything like the degree of class that Gregory Peck brought to the first Damien story in 1976. For diehard fans of Satanic-themed movies (count me in!) this is rather thin fare.",6.0,11 April 2024
"Almost, but only almost. Hm, probably the female factor.","An amazing look, it looks like it's from the times when such films originally belonged, the wild 70s. Well, that style soon turns out to be a simple sepia filter, but still. The omens were generally rather modest, another franchise being exploited. There are rather poor role models for such commercially orientated projects, especially in recent years. But the makers dared to go down a classic path, not only visually, but also in terms of staging, and were well rewarded by the general criticism of the film, which was positive. However, the consumer is the decisive factor and the expected money was not made at the cinema box office. The Omen is not a pure shocker, more of a mystical slow burner with a few nasty spikes. Courageous, because this is now only partially in line with the horror-affine part of the audience, even the trailers nowadays have to promise gruesome, permanent terror or brutal splatter. The script is interesting, a really good idea for a prequel. With all the agenda, eccentric Judaism or unbearable Islam, the film once again provides a good reminder of how strange many things are in Christianity too. I was well entertained, but I don't see the need for a re-watch, there is simply a lack of iconic sequences.",6.0,2 June 2024
Such a surprise,,8.0,8 June 2024
"A standard movie with decent visuals, though not outstanding.","The scariest movie of 2024? No, that's absolutely far off the mark. 'The First Omen' isn't the scariest movie of the year, but it offers nice twists and turns, anticipation, and suspense. The storyline is engaging, although there are similar movies with comparable themes. Despite that, it remains watchable and interesting. The performances, especially by the lead actors, bring depth to the characters, and the atmospheric soundtrack enhances the eerie mood. The cinematography captures the dark, foreboding ambiance effectively. Overall, it's an intriguing prequel that leaves us curious about what Damien has to offer the world next.",6.0,8 June 2024
Diabolical!,"Another absolutely awful rehash of a classic that actually has the nerve to change a key element from the original story and then try and tie it in to the events leading up to the first film. That indicates that they don't even care what fans of The Omen think and are just going for a younger audience. As for the film itself, it's the usual fish out of water horror set up with a naive American trainee nun sent to a shadowy convent in seventies Rome to take her vows. It's all very obvious stuff and is strikingly similar to the other recent and slightly less bad horror Immaculate except this one has more tired jump scares and awful cgi gore. The performances are tepid given the terrible material but particularly bad is Bill Nighy who seems to have wandered off the set of comedy. Stick with the original or even part 3 or 4 which are masterpieces compared to this tripe.",1.0,21 April 2024
A prequel to a film that's almost 50 years old but still manages to pull it off in hard hitting way.,"One of the very few horror films that's ever made me go ""This is cinema."" quite a few times. We don't see horror cinema with such pleasing aesthetics, impeccable acting and beautiful writing these days. Arkasha Stevenson crafts an absolute classic and what is, in my view the best prequel to any IP horror film. This is what happens when studios truly respect the filmmaker's vision and let them cook and care for their fans.

I wouldn't call this film to be scary but it's more of an unsettling origin story to a nightmare that came out nearly 50 years ago yet commands praise and glory with this take on the birth of the 'Son of the devil'. It didn't need to hit this hard but we're here for it. Now, let's give Arkasha Stevenson more horror films and place her among the elite of the new gen horror filmmakers. She's an absolute showstopper and a rock star. This is best thing to have happened to the Omen franchise since its inception.",9.0,5 April 2024
good style to a non-interesting story,"I never liked original Omen story as well. It is boring and not scary. A kid causing terrible things around, it was all about and the original Omen story was just like that, someone falls from ladder and then we see a closeup of the kid's face, so what, everyday people fall from ladders :) Anyways, this movie cinematographically fine, director done his best and done the max that could be done with this simple silly story.

Overall, not scary, more mystery and thriller type, no intention to scare the viewer as well. Also, in terms of horror genre, there is nothing new in terms of element.

I read the reviews a lot before watching, everyone was hyping about the birth scene etc, there is nothing scary about the birth scene, for god's sake. We saw much more scary gory scenes in other movies.

In short, dull story, nothing new about horror genre, not scary, perfect PR job, and people who have no idea about horror movies will like it.",6.0,28 May 2024
This should not have been allowed use the name name the omen in the title,"Religious horror movies don't need gore or jump scares - they need to have suggestive, sinister plots that you can't really rationalize. This movie has nothing.... not an iota of anything even remotely unsettling or clever or sinister. It's so bad... despite as fairly decent cast it fails miserably. There are entire scenes and dialogues that are just pointless.

There is another movie, same movie different production company, way better.. released 2024 called Immaculate watch this one instead. The First Omen is a shambles of a movie and that's being generous!

It's a pity because it had so much potential. Story wise.",1.0,30 May 2024
What if evil is a real part of our life?,"It's difficult to make your own film when it has to be the prequel to one of the most iconic horror pictures. Yet this effort, while seemingly all over the place, and having to retread the major tropes of the franchise, comes together as the run-time agglomerates on, resulting in the most profound expression of the Catholic Church's sex scandals that I've seen thus far in cinema.

That said, it's not much more of an exceptional film than on those terms. There's some time relishing the period piece mis-en-scene in Act I, and as with major motion pictures in general nowadays there's a high bar for quality photography, and indeed there are even some great shots (c.f. Any setup with a mirror, or the noir tight angle of the lead character walking toward the camera in a dark alley). But the horror is all almost comically overdone, relying on jump scares, most of all loud sudden noises, and trying to depict demons at times via practical effects and at other times more CGI, but always running into the same issue that was present in Night of the Demon: we can't suspend our disbelief at a representation of something so alien to our lived experiences, so the monster is met with incredulity--on the other hand, the evil that humans actually inflict on each other, as depicted as well as hinted at/allegorized, is movingly impactful.

I'm in general a fan of satanic possession/incarnation movies, as they get us to think about moral philosophy in the entertaining imaginative spaces of the horror genre and the superstitions of religions we're supposed to have shed. The Omen is as much of a lodestone as The Exorcist and Rosemary's Baby in that regard; and while I don't quite have the same response to this prequel as I did to the remake of The Omen--a fine movie, but simply a modern production of the original, and therefore why did that money need to be spent, and that time diverted?--there is the question of why The First Omen needs to wallow in modern horror trappings, rather than totally focus on the actually compelling themes--first of all, the matter of being gaslit over evil that has traumatized you; and also, more secondarily, the political climate of the '70s (especially Italy), as secularism takes over cultural hegemony from religion (thereby threatening the relevance of long-time ways of doing and thinking about things).

(One more note: the noir diversions with the priest who introduces us to this picture, while certainly an entertaining convention that we're all accustomed to in this subgenre of devil cinema, feel superfluously sewn on--""characters"" reading lines we know too well by now.)",6.0,6 April 2024
Unique story,"I just got back from The First Omen. But I did found the story the story very interesting. I think it's a bit like Midsummer in terms of shock factor. I didn't found it that scary it's more shock factor than scary. Some scenes were very impressive and a bit unsettling. Unfortunately found the story a bit confusing. If I were to see this film again for the first time, I would first look up some information so that I understand it from the beginning. I also recommend that people do this unless you absolutely don't want any spoilers. It was certainly a unique story. Not your typical supernatural horror films. If you are tired of the typical horror films, this is a good one to watch!",6.0,13 April 2024
Mostly predictable...but still enjoyed it,"I just finished watching The First Omen earlier tonight. I was able to predict almost everything that was going to happen. It definitely seemed like they were following a formula. However, even though I knew most of the story ahead of time, I still enjoyed watching it. The actors did a good job and there were some genuine creepy moments. I was surprised by the lack of subtitles at first. However, I think that is because we are meant to be as confused as the main character. Also, I wonder if they pulled the same trick as The Thing, where everything said in a different language was actually giving the plot away. Also, while you do not need to have watched The Omen, it will help with noticing the various Easter eggs hidden throughout the film.",7.0,13 April 2024
