review_title,review_body,rating,review_date
A Demonic Debut Steeped in Suspense,"Arkasha Stevenson's ""The First Omen"" isn't just a prequel, it's a possession of its own. This chilling horror film slithers back to 1971, weaving a narrative of faith, fear, and the unthinkable birth of evil. While it doesn't quite reach the iconic status of its 1976 predecessor, ""The First Omen"" delivers thanks to a captivating performance by Nell Tiger Free and a masterfully unsettling atmosphere.

Free shines as Margaret, a young novitiate summoned to Rome by a mysterious cardinal (played with delightful ambiguity by Bill Nighy). Thrust into a world of ancient secrets and unsettling rituals, Margaret's unwavering faith begins to crumble as she uncovers a plot to usher in the Antichrist. Stevenson masterfully builds dread, relying less on jump scares and more on a pervasive sense of wrongness that crawls under your skin. The film's 70s setting is beautifully rendered, with the opulent Vatican contrasting starkly with Margaret's growing unease.

However, ""The First Omen"" isn't without flaws. The middle section drags slightly, relying on a scavenger hunt-like plot that feels a tad derivative. Additionally, some may find the film's graphic birth scene, while undeniably impactful, to be a touch excessive.

Despite these minor stumbles, Stevenson's vision remains captivating. The film's true strength lies in its central performance. Free delivers a powerhouse portrayal of a woman grappling with the monstrous truth. Her journey from unwavering faith to fierce defiance is both terrifying and strangely inspiring.

""The First Omen"" might not be a flawless masterpiece, but it's a worthy addition to the Omen franchise. It boasts a chilling atmosphere, a standout lead performance, and a refreshingly original take on the origin story. If you're looking for a horror film that will stay with you long after the credits roll, ""The First Omen"" deserves a place on your watchlist. Just remember, keep the lights on...",7.0,11 June 2024
NOT BAD!,Prequels in general drive me crazy! They always try to oversell something and make pieces fit that absolutely will not fit! I have to admit that this is one that actually does not do that. Was it perfect? No.....but it is one of the best horror movie prequels that I've seen along with the ALIEN franchise. What made this one so enjoyable to watch was the simplistics of it. From the music and sound effects to the acting cast and special effects. There were a couple of missteps in here but nothing that couldn't be overlooked. My GENRE of choice is and will always be horror (all categories). HULU has had some hits and some misses with original movies.... Hell...all the the streaming services have BUT don't stop trying because this is one that that was a pretty good hit. Enjoy the movie first and then critique it.,7.0,9 June 2024
good,"The film The first Omen is a solid achievement.

The lead actress (Nell Tiger) is a very beautiful woman who has gone out of her way to do her job very seriously.

The weakest part of the film is certainly the scenario in which the Catholic Church is portrayed as a godless institution that uses Faith as a lever of power. What Father Brennan said that there are also True Believers is completely insufficient, because everything takes place in a completely non-ecclesiastical sequence of actions and events (the Holy Mysteries and the power of the Cross are not used at all against satanic activity).

The idea that growing secularism weakens the worldly power of the Catholic Church is extremely inappropriate because secularism is also very aggressive and full of lies, and that is very clear to everyone.

The idea that any Church of Christ (Catholic, Protestant, Orthodox ...) would bow down to Satan for the sake of some kind of preservation is especially absurd.

It is completely clear that the appearance of the Antichrist will mean the destruction of the World and an attempt to destroy the Christian Faith.

According to the words of Christ, no one would remain, if God himself, Jesus Christ, did not come a second time in Divine glory.

In the film, Satanism was forced into the Catholic Church, which is not natural and normal.

The Catholic Church itself has real trials such as pedophile scandals and dogmatic interpretations of the Pope about its role and the Catholic Church itself, so it is not right to add such a satanic conspiracy plan to its essence.

I believe that the Catholic Church will offer strong resistance in those antichrist times.

The shots in the film, the Italian ambience of the 70s, the direction and everything else is excellent.

The film is a refresher for the horror genre.",6.0,1 June 2024
A horror treat for horror fans....,"The First Omen will give you a terrific experience of horror, and some very disturbing scenes which will make you think what you have watched.

First of all I didn't watch any of the previous films of this franchise was completely gone with zero expectations but after watching it I can say one thing for sure this is the best horror I've seen in recent times.. Superb direction by Director Arkasha specially the way she has presented the film wih every scene is just amazing to see.

Movie builds up a strong scary atmosphere which will definitely maintais the balance of horror & some terrific thriller portions that audience will not expect.

From the first scene itself the movie indicates you that this isn't a generic horror you've come to watch because it has a strong gore & violence substance which definitely the story demands and the director didn't hesitate to show.

Screenplay is well engaged yest it takes time at the start but still you'll be interested to hear more whereas Cinematography is also quite good at some places with unique camera shots and frames were shown.

NELL TIGER is the soul of this film in every frame she shines and there's a scene in the film where she kinda fights with evil that scene is just pure goosebumps for me and the performance of her in that scene is 🔥.

Story isn't new that we haven't seen previously but what makes this film better is the performance of actors and proper direction by Arkasha Stevenson.

Overall this movie for me is unexpectedly good because it's surprise you at many points rather than a typical horror. It has horror but don't expect it to be light hearted because there are some serious scenes which some people are not gonna like... (4/5).",8.0,5 April 2024
It could have been much more,"So, first of all: Damien's mother was a jackal. That is fact, also a crucial point in both three movies. I don't get it, why they left out. It wouldn't have been a bigger scandal, than the one they left in the film. Probably because of the age rating, but hey: do it right, or don't do it at all. At least that's my opinion.

The cult is somewhat ok. Satanists must be pleased as well, I get it. They still pay for the tickets :) And, we know from the first Omen, that a sect was behind the intentional swap of the babies.

The cheap jump scares: ewww. Stop them please, they're really outdated and overused by now. Not to mention, they take away the edge of the real horror atmosphere.

These.",6.0,5 April 2024
Something's not right,"Among the disturbing and best things about The Omen from 1976 was the revelation that Damiens mother was a jackal- Both with priests warning and then they open the graves...holy cow... so what's wth the nun bonanza?? Sure theu got the name right and all but still. Major mi9stake if you ask me and a very big missed opportunity.

Otherwise the movie has great pace and the acting was better than expected. I will not give more than a 4 because of the jackal blunder which I think was a big mistake. The movie is a solid prequel though. I counted 3 jump scares which is better than the majority of horror movies today.",4.0,2 June 2024
"Genuinely one of, if not, the most unsettling films I have ever experienced","I have not been shaken to my core by a film or television series in years. I thought I had grown numb to horror, occasionally being grossed out by gore or weirded out by some wild concept. This film was different. It brought something out of me I hadn't felt in ages: pure terror.

The story is a slow burn at the beginning, but once it picks up momentum at the end of the first act it does not take a break or slow down. If anything, it picks up speed, and leans into the nefarious ideas presented in this plot.

The acting was superb, especially the lead role of Margaret. She stole the spotlight for the entirety of the third act, despite all of the other intricate pieces moving around her character. Nell Tiger Free has the ability to move her body and control her emotions in such ways that were nothing short of breathtaking, both in the most lovely and demonic senses of the word.

Finally, the ideals and concepts presented in this film are going to live rent-free in my mind for quite some time. I left this film feeling slightly foggy, bogged down by the weight of what I had just experienced. That is not to say that this film was bad by any means, if anything the opposite. It executed its purpose precisely as it had set out to do. It left an impression on me, as well as my friend who I saw it with, one that we agreed would almost certainly give us nightmares and/or keep us awake tonight.

For any horror fan, this is a must-see. Truly underrated unexpected. 9/10.",9.0,9 April 2024
Very Good Prequel,"Taking place before the events of the first film, The First Omen follows a young nun who moves to Italy and uncovers terrifying conspiracies in the church as they try to birth the anti-Christ.

Nell Tiger Free gives an astounding performance as the young nun caught in a web of religious terror and there are several images that are unforgettable. The Omen franchise doesn't need another sequel or prequel, but The First Omen makes a good case for having one out there in the world. Fantastic cinematography and sound mixing help an awful lot and help to create an unforgettable movie experience. It makes me eager to see where they could possibly go next with this franchise.",7.0,25 May 2024
Don't waste your money,,1.0,8 April 2024
"Excellent, Brilliant, and Demonically Scary 😈😈😈","The prequel to the 1976 classic The Omen this movie tells the story of a nun who is migrated to Rome under the catholic homage to provide service there .As the plot unfolds she comes to know about the sinister secrets and hidden agendas of the priest and the nuns there .As things get more darker it's come to her disclosure that they have a plot to give birth to the antichrist through the anointing of a child by delivering the baby to the devil .And the rest of the story is whether she would be able to stop it or whether there is more that she's to know about finding the assigned child who is to give birth .Nell Tiger has given a convincing performance as sister Margaret and has captured the essence of the story .Although it isn't the most terrifying and scariest movie out there it is definitely an interesting watch and there are chilly moments and sequences that keep you glued to the story and curious to find out about what's going to happen. The cinematography and background score have been exceptional and does manage to create an eerie atmosphere throughout.

This is a fantastic film. The production is gorgeous, not only is it a well-made portrayal of past Omen films except Omen 4., other than the brilliant slower pace and the sheer patience of specific scenes that enhances the moment, it also throws in 70s era cars and fashion that is fun to see. I thought the classic panning in and out of the camera was very much similar to older films of that era...just wonderful. It's just done so well that I feel this is perhaps the best horror film I've ever seen not just by plot alone but by its close attention to the art form in general. When you see a horror movie, you want to feel somewhat trapped. The movie is that intense. I even found myself looking at dark spots in the theater thinking it was a ghost or demon watching me! You won't and can't be disappointed with this movie, highly recommended.",9.0,5 April 2024
Not worth the hype,"Came here for Bill Nighy and Charles Dance. What a disappointment. Great actors underutilized, yet the lead female is such a lackluster character that forces emotional appearance and reaction.

And, why do directors think showing black screens with background screams increases the terror intensity for the audience? We want to see the action, period!

For the kind of budget suggested here, this was a rather shoddy piece of art that went on for too long when 80 minutes would have sufficed.

Watch it if you have ample time on your hands but willing to suffer through an imitation of the horror genre that is easily forgotten.",3.0,1 June 2024
Great prequel!,"In 1976, director Richard Donner came up with The Omen. We also know Donner from films like Lethal Weapon and of course Superman from 1978. In the lead role, Gregory Peck played the role of Robert Thorn, an American ambassador to Rome who tragically loses his first child at birth, but has it exchanged for a baby where the mother died at birth. Unfortunately, Thorn adopts the antichrist and with that story Donner scared the viewers. The film then got two more sequels, with the epic about Damien ending in 1983, at least, it seemed. There was a fourth part where the antichrist returns in the form of a girl, but this was so hopelessly bad that we prefer to forget that part. It remained quiet until 2006, when suddenly a remake of the original The Omen came, although this was not a really bad movie, it was a strange decision because the original was good enough and didn't need a remake. In 2016 there was another very nicest series called Damien, which unfortunately only ran for one season. Now there is The First Omen a prequel to The Omen from 1976 directed by director Arkasha Stevenson, who makes her first cinema film. This is risky with such a film of course, but Stevenson debuts with a strong prequel, where it is to be hoped that more will follow.

What the film excels in is that it doesn't follow the standard route by using a jumpscare every few seconds to entertain the audience. No, The First Omen is more than that. It's a real slow burner, because the film takes a good time at the beginning to properly portray the situation. When Maggie arrives in Rome, Cardinal Lawrence explains to her that there are popular riots between Italian citizenship, including motivated by students who are dissatisfied with the state and the Holy Church. This ensures that the church people could sometimes make it difficult to go down the street. Just before Margaret is initiated by the church, she goes out for another evening on the advice and invitation of her roommate Luz. Margaret drinks and dances with a man and wakes up the next day with no memories of the evening in question. Of course you already feel the mood hanging and you realize that there is more going on than you would expect at first glance. As life moves on again, Margaret gains a strong bond with Carlita, an orphan plagued by the most heimous visions. And then she meets Father Brennan out of nowhere who warns her about Carlita and that bad things are going to happen around her. But Margaret doesn't believe him until a heilful incident takes place.

In any case, the film literally takes place before the prologue of The Omen (1976), which ensures that this film seamlessly connects to The Omen (1976) in terms of story. What the film also excels in is the cinematography, for that reason alone, The First Omen is worth watching. But the time picture from the 70s is also strongly represented, making the connection of this film feel quite natural to The Omen (1976). The film does have quite a few slums scenes that make the film rather controversial, because not everyone will be able to appreciate this. Especially the childbirth scene is one where you can ask your questions about whether it is necessary to portray this in this way. In my opinion, yes, because this gives an extra sinister view of the whole event, after all, we are dealing with the ultimate evil here and the devil will leave nothing behind to sow pure terror of course. In that regard, the creators were not guided by what others would think of it and they just went their business. The ending may not come as a surprise, because although an attempt is made to give it a surprising twist, it is actually clear after a little while in the film how or what, but luckily that doesn't bother.

The First Omen is the cinema debut of director Arkasha Stevenson on the classic The Omen (1976). That's quite dangerous, but Stevenson has done a fantastic job and The First Omen has really become a strong prequel. It fits seamlessly with The Omen (1976) and that is a nice side effect. The film is nowhere to become slugber and in addition, the film is sometimes really eye-catching cinematographically. Fortunately, the makers have not put themselves on a constant supply of jumpscares, as most makers do. No, The First Omen is a real slow burner, which gets more under your skin by the minute and eventually competes with a singing climax. Although this may be stingling, it's not surprising, but that doesn't matter at all, because if as a maker you can make a prequel to one of the most controversial horror films of all time, then you really have to come from good houses. Richard Donner will probably have been proud of how this film lives up to his 1976 classic.",8.0,31 May 2024
An absolute insult to the original Omen,,3.0,13 April 2024
The First Omen surpasses expectations and delivers an impressive addition to the horror genre. I was thoroughly impressed with every aspect of this movie,"Tonight, I watched The First Omen (2024) in theaters. The storyline follows an American woman who moves to Rome to live a life under the church, teaching in an orphanage. There's something unique about one of the girls at the orphanage, hinting at a strange hidden plot unfolding...

Directed by Arkasha Stevenson in her major motion picture debut, and starring Nell Tiger Free (Game of Thrones), Ralph Ineson (The Witch), Sônia Braga (Kiss of the Spider Woman), Charles Dance (Game of Thrones), and Bill Nighy (Pirates of the Caribbean: Dead Man's Chest).

This movie exceeded my expectations by a mile. Throughout the entire film, I found myself questioning why it was so good. The First Omen brilliantly captures the era in every aspect - from attire to backdrops, camera angles, and lighting, evoking a nostalgic 70s feel. The storyline is clever and fits perfectly within the series. The acting is remarkably good. There are at least 6-7 standout horror scenes that deserve a perfect 10/10 rating - such as the gripping glass sequence at the opening, the good acting at the car crash, and every birthing scene. The atmosphere throughout the film is deeply unsettling; you're constantly piecing together the mystery, with well-executed jump scares keeping you on edge. Even the use of CGI fire, which I typically dislike, was easy to dismiss because the scene was fantastic. And the ending? Absolutely perfect.

In conclusion, The First Omen surpasses expectations and delivers an impressive addition to the horror genre. I was thoroughly impressed with every aspect of this movie. I would give it an 8-8.5/10 strongly recommended it.",8.0,6 April 2024
Revelations: This Is Dumb,"Lmao. First 5 minutes and I knew who was going to be the person who crapped out the Anti Christ. I firmly believe there should be a committee that has the right to sue absolutely uneducated and inexperienced directors, producers and script writers, for scamming more intelligent people that should have their jobs. Every time a movie is predictable and bears no originality should be sued so we can get our money back and the director should be in the $200 million debt that they decided to bring upon themselves. This is basically stealing from people in broad day light. There really needs to be a group of people that have the right to sue these so called directors so we can get our money back and so they never make another movie ever again. The script is child's play, an insult to anything Godly. In fact it seems like this is just made to shit on God. Lol.",1.0,28 May 2024
⛪ Create Something To Fear ⛪,"Just Got out of a Screening of The First Omen.

Firstly, the Lead Actress Nell Tiger Free, WHAT A WOMAN!

Secondly, Arkasha Stevenson, a first time Full Length Feature Director? Really? She Clearly has a Talent for this.

😍 Nell Tiger Free, In that all Black Outfit with the Black Hair, She's just Constantly Beautiful To look at. What a look! Gorgeous Woman. And then on top of that, her Performance Just kept building Stronger and Stronger as the Film went on, That Convulsion Scene was such an Experience to Watch.


What i liked about the film -











Overall, Good Plotline with Super Strong Moments multiple times, and an Outstanding Performance by Nell Tiger Free, it's a very surprising Watch.",10.0,5 April 2024
Horrible and Dumb,,1.0,8 April 2024
By far the best thing you could see today in such overused genre,"I mean, seriously, we are living the age of running out of ideas, rehashing old materials, rebooting/remaking franchises, seeing all kinds of cliché tropes in such limited genre as the horror can offer. In the last decade the subgenre like retro-horror/psychohorror also emerged that many times brought back the essence of past ages, like the 70s, 80s, that also becoming dull now.

And here comes The First Omen that already by the first scene it reminds you of the old movies, like it was straight made in the 70s; oldschool film-like image framing, scene blocking, grains, the color palette, the environment, costumes and props totally fitting to the giving time of age, everything hits that classic, oldies line, it will easily remind you of The Exorcist opening scenes (1973)

The cinematography is mind-blowing... seriously, just for that you should see it; the visual narrative is so sophisticated, almost elegant in a classic way, that it will be a total unique experience to watch for such genre as this in the modern days. I was literally shocked how perfect it is. Whoever was working on this understands moviemaking, on the highest level, especially how good horror movies work. It's on par of the level of The Exorcist, or Kubrick's The Shining.

This is a classic horror movie mixed with modern trends, finding the right balance between these two worlds. It will have clichés that you were seeing in most motion pictures in the genre, but still presented in such manner you won't sigh or feel numb, because it totally gets it's own boundaries.

The casting and acting is also superb, the main character might seem a bit off in early stages, but damn, as the third act hits in, what a sight to see. You will see body movements (yeah) done in almost dancing-like manner you will ask yourself ""How the hell did she do that even? That's amazing!""

So, back to the presentation: yes, it is considered slow-paced for modern standards, gives time for the whole theme and the fright that it beholds deeply digging into you as it can, and it will have the right ammount of power doing that, damn, it elevates to such dark, deep rotting horror emotions that will most possibly compensate for the slow-pacing (even though this is the right tempo for me, but could understand it might be problematic for some), and in this the whole music, sound nature of the movie also gives some hand. Overall terrific execution presentation-wise.

So, long story short: It might hold some cliché, modern movie making tropes, even story-wise that are coming from both the limitation of the genre/sub-genre and also the fact of it being a prequel for an existing movie, however the high level of understanding movie making in general and the execution of that will most probably make you easily forgive those little shortcomings, as the movie in general is hitting hard, as dark as it can get, as it should be for a horror movie. Easily one of the best horror movies of the decade, and that's not even an overstatement.

P. S.: A week ago I also watched the Immaculate and I honestly feel the absolute right comparing these two especially in the context of the difference between modern and classic horror moviemaking. Immaculate is so bad compared to this that I would feel ashamed of watching it if not seeing the parallel between these two... a really shameful product. So yeah, The First Omen all the way.",8.0,7 April 2024
"A bishop, a priest and 3 nuns walk into a bar...",,5.0,11 April 2024
