review_title,review_body,rating,review_date
Brilliant prequel,"I love the omen trilogy and was looking forward to this for ages . So glad it was a prequel so we could see what the story was before the omen . In my opinion this film is a masterpiece . Eerie music, great shots, brilliant acting and some great scenes just like the original omen films . Highly anticipated and well worth the wait . Charles dance and bill nighy were great . And the actress who played Margaret was amazing . The pregnancy and birth scenes were really well done . I won't give anything away about the ending but am intrigued to see whether it carries on. I'll be rewatching omen this week.",9.0,8 April 2024
Rip-off of possession,,4.0,6 April 2024
Mannn what a turn of events!!!,"If you like movies that will keep you on the edge this movie is for you!!!! Literally every 10 mins it was a different twist to the story! Each minute that went by the movie got better and BETTER!!! There is definitely 3-4 ""jump"" scares in the movie. But man oh man. This was definitely a good one! But overall this movie is an easy 10!! If you're into ""cult , priest , church , ""satanic vibes this is definitely for you. I don't think I seen a movie this good in an extremely long time. They did an awesome job directing this movie from start to finish. Literally everything made sense. A guy in the movie voice is a little deep and it's hard to under him. But if you listen real closely you can understand him. 10/10 easily.",10.0,2 June 2024
Has no place on the Omen franchise,"Poorly written and poorly executed.

This movie attempts be part of the Omen series claiming yi be a prequel and yet it seems that the film makers have not actually seen the originals. The links are inaccurate and fail the connection, parts from the original stolen/reused and a last ditch effort to link by needing to call out character names.

This movie was an insult to the original series.


Rather than an Omen movie, it is remarkably similar to another horror ""Immaculate"".

Immaculate on the other hand manages to stand on its own 2 feet, being better written & directed, not to mention it is not trying to ride the coat takes of other success.",2.0,28 May 2024
Genuine thrills and chills!,"I will say it's a tad long and I have watched Immaculate as well. Which is very good but has some histonrics in the middle. This movie has a lovely set up with some excellent mood setting and production design. The cast is uniformly great.

I'm a UK viewer so I'm already a fan of the cast. I'm an Omen 1&2 fan so turned up for some fan service. But this movie actually stands on its own. The character building feels genuine with the seventies setting is evocatively told.

Yet it has a subtext similar to Immaculate but approached the ideas differently which could only be told with modern sensibilities.

There were some very scary moments up there with The Changeling and Heradatary. A very high bar. Loved this movie.",9.0,1 June 2024
Garbage,"The First Omen is a colossal disappointment!! The script is full of plot holes and the directing is just awful. It's a shame because there was some significant talent in the actors both old and new. I wanted to enjoy this installment but it's just a big sloppy mess!! Studios really should be more discerning about what they release especially in a prequel to notable classic horror movies. The first three Omen movies were very well done with a cohesive sum of acting, directing, and script all complimenting the story and theme. This was all over the place and I wouldn't recommend it at all. Thumbs down.",1.0,31 May 2024
CRAZY MOVIE THAT MADE ME STOP IN MY TRACKS,"I'll admit that when i first saw that it was another nun movie I rolled my eyes because I love horror movies but have a hard time finding ones that arent a waste of my time. The cinematography and 70's style of Rome was beautiful and the story telling was set at the perfect pace with an intriguing plot that kept my attention the whole time (which is rare for me). It was a pretty intense movie due to the sinister sound track, grotesqueness, and raw emotions (almost to the point that I had to step out and take a break) but all in all it was an absolute masterpiece. From a person who almost only watches horror and crime stuff believe me when I say that this was 100% worth the time.",10.0,16 April 2024
Absolute nonsense. Not an Omen movie at all.,,2.0,4 June 2024
Refreshingly GOOD! Why are the ratings so low!???,,9.0,28 May 2024
Is Satan so stupid to help a bunch of priests and nuns? Where is the logic for god's sake,,2.0,21 April 2024
Damien's Origin Story,"Watch this BEFORE you see the original 1976 Omen which is on Hulu currently. I knew the last word of the film. Damien. If you have seen the original 1976 Omen you will find the answers you didn't know you neeeded. This movie gave Rosemary's Baby vibes as well. Who can you trust and you don't know who, where or what you come from? This made me very excited to go home and watch Omen 1976. I'm watching it as I type this actually. I gave this First Omen an 8 because I still have questions but I'll rewatch to get those answers too! Everything was mild in horror but so is the original. See then go see the original.",8.0,22 April 2024
anyone who enjoyed this movie is a little off in the head....,This movie made me EXTREMELY uncomfortable.... There was tooooo much moaning and whimpering in the movie that would last for long periods. On top of that the scene with the vag!ina is so uncalled for..... The movie wasn't even scary.... I'm more so disgusted. I'm shocked like wtf did i just watch.. I wish the movie showed more of the beast and i also wish there was more depth to the girl who killed herself because her laughing wasn't even scary it was just akward. A lot of the scenes were just akward and i think i had the same disgusted face the entire movie... I can't even think of one good scene.,1.0,12 April 2024
Slightly Traumatized.,"I've watched the Omen when I was a child, and thought it was scary back then, I even enjoyed the remake, and thought it was a bit scary, but this movie, had me clutching my invisible crucifix.

I'm not going to tell the movie or anything, but there were several scenes where I actually said out loud, what the hell am I watching.

The crazy thing is for years I've talked about how horror movies are wack now, and how movies back in the day was scary with limited technology, I've even stopped watching certain horror movies because of the disappointment.

Now finally, they make this movie with a lot of thought and details, I don't know whether to be appreciative for them thinking outside of the box, and going with it, or calling 911 and pressing charges, lol. This movie was wild, I think I need to go to church tomorrow. I feel violated, and confused.",8.0,2 June 2024
"Not scary, nothing like the original Omen","The real ""first"" Omen from the 1970s was terrifying. I saw it as a young kid in the 90s and it gave me nightmares, especially considering my early upbringing in the church. A prequel to the original Omen might have been good, but this attempt was not. The movie was not scary AT ALL!!! It came across as more of a trippy student art film than a horror film. Also parts of the movie were so dark it was impossible to see/understand what was happening. I disagree with what one of the other commenters said about jump scares- ANY jump scares would have been better than nothing, at least it would have added some element of fear to the film. I don't understand all the positive reviews for this movie. Either people are getting paid to write these reviews or they have never seen any of the original Omens. Even the remake in 2006 was better than this!",2.0,15 April 2024
"Wow, quite the divisive movie!",,8.0,8 April 2024
Major plot holes for a prequel that is unenjoyable on its own,"Very dark/different type of film with a talented lead actress, but the story/motive itself makes no sense. The story is based on the antagonists' very faulty, inaccurate theory/motive which directly conflicts itself. It's also one of the slowest burning horror films that had me wondering when the story might actually begin. There were unnecessary scenes throughout that add very little to the story and major plot holes as well.

The worst part is that unless you're aware its preexisting sequel is a film from the 1970s, viewers are left with a pointless, hopeless, bag-guys-win storyline that ends randomly and abruptly.

I would never watch or recommend this movie to anyone for any reason. Dark, boring, slow, pointless.",2.0,28 April 2024
Heat movie with a funny mistake on it.,,8.0,31 May 2024
Garbage well filmed.,"The great horror film classics are related to the Catholic Church: The Omen, Rosemary's Baby or The Exorcist. Here we are faced with an unnecessary sequel that, despite being well filmed (my respects to whoever directed it), the story is unsustainable on all sides; the idea of presenting the antichrist as the product of a conspiracy where his unlikely protagonists are as serious as I am as a quantum scientist (I'm not). There is a priest who claims to be excommunicated but always stays in church rooms and who seems to be quite functional for the plot, a group of nuns who would not be allowed in any monastery in the world, a cardinal who does the work of a bishop and It never demonstrates the need for such a high position and a constant use of circumstances that are cliché in every film of the genre. What's more, at one point I laughed after a certain moment that involved an accident that when you see it you will know what I'm talking about. It's a movie with such a bad plot that it does little justice to the first three Omen movies (I won't tell you about the other one because, like this one, it's garbage). Here all the female characters are unpleasant and if it weren't for a bizarre ending where the devil's progeny (incestuous in a way) survive I could assure that it is difficult to overcome this crap. There is an open window to a parallel line when it comes to plot, which tells me that producers should reconsider when approaching the classics. The classics deserve respect and not garbage like this.",2.0,12 April 2024
Makes you tingling,"I've to be honest ! It is rare to me that in the a particular horror movie i really get terrified and even more than once terrified ! Yes this movie made me terrified at least twice and it was really scary ! Some of the scenes was really atmospheric horrifying ! Some times it scares you in silence and sometimes jumpscares ! It has some twists in the story and this is real horror cinema ! I've enjoyed every bit of this journey through the basis and origins of damien ! And i can not wait for the sequel.

Actors/actresses were good and sometime even above good specially Nell Tiger Free , she nailed that role perfect.",8.0,29 May 2024
A missed opportunity,,5.0,6 April 2024
I absolutely loved this.,"I watched this in the cinema after letting my boyfriend pick a random movie and I thought I was going to like it.. surprisingly, I absolutely loved it.

I thought some of the scenes were a bit cheep, like when it came to the jump scares but it was because it wasn't anything new. It was a bit predictable because they took some of the jump scenes from the original story. It was like I was 5 seconds a head of the movie every time something was going to happen.

At first it seemed kind of slow and confusing but it was worth it for the bigger picture in the end. Even though its been done 4 other times before I think they did it justice.. I'll admit I hope they do a second one and I wasn't a big fan of the originals.

Also when Nell Tiger Free came on screen I knew she was going to do an impressive job. She never fails to impress me when it comes to her acting.",8.0,10 April 2024
A poor imitation of the 76 version,,1.0,4 April 2024
Extraordinary 'Ave Satani' Evocations,,8.0,30 May 2024
What a complete waste of time,"Not only is there NOTHING scary about this movie. Not a thing.

But the movie also completely ignores lore and what made the first Omen movie(s) great.

Gone is the jackal.

Gone is 'hinting' at the sinister (and instead we see full devil out of V scenes, etc).

The director here really missed the mark - and what a huge surprise it's a female director who is so removed from reality and not equipped to direct anything at all.

Give this one a huge PASS. It's SO bad.

Not only is there NOTHING scary about this movie. Not a thing.

But the movie also completely ignores lore and what made the first Omen movie(s) great.

Gone is the jackal.

Gone is 'hinting' at the sinister (and instead we see full devil out of V scenes, etc).

The director here really missed the mark - and what a huge surprise it's a female director who is so removed from reality and not equipped to direct anything at all.

Give this one a huge PASS. It's SO bad.",1.0,5 June 2024
Pleasant surprise!,"I went into this movie with pretty low expectations given how sequels/prequels/remakes (especially of classic horror) typically go. However, I really enjoyed this movie! Some great cinematography, and I really enjoyed the score, which reminded me a lot of the vvitch. It's more of a slow burn/psychological/body horror with some moments of gore. I really enjoyed the pregnancy/loss of bodily autonomy messages. Relatable in this day and age unfortunately. Good horror tends to hold a mirror up to current social issues, and I feel this movie did that as well. Curious to see if they keep going with this storyline based on the ending, but I absolutely want more!",8.0,1 June 2024
Rated 6 6 right now - well thats an omen,"But ok one 6 is missing, but I guess thats significant with this movie,,, missing parts

This is a mess , its an abomination,,,, I had so much hope in this , omen have been little pushed aside lately,, so much potential in the idea so this was something I waited for , but once again you sit there and twisting you in the sofa, its just not good

Im not a fan of omen original actually, great story but didnt came out than well in a movie perhaps but yet its a classic from my childhood , I must say omen 4 is the best one of them all but this movie could have been the movie to rule them all , instead its a pretty boring and strange written story, I didnt like it atall, and what is that with nuns thats smokes and making sexjokes, thats very catholic italy,, stupid

People like this anyway and thats also typical cause this is a different movie and it stick out for the rest and thats enough for create a hype that people like also

Nope,, will not watch this again, slow, boring, strange and stupid.",4.0,2 June 2024
"""The First Omen"": A Diabolically Good Prelude!","Welcome to the eerie corridors of ""The First Omen,"" where the whispers of the past echo with a chilling clarity. As the latest entrant in the spine-tingling Omen series, this movie takes us back to the origins, offering a fresh, albeit shadowed, perspective on the tale we thought we knew. Strap in, dear reader, for a review that dares to dance with the devil in the pale moonlight!

Acting with an Unholy Grace

""The First Omen"" presents a cast that performs with such convincing terror and turmoil that you might find yourself glancing over your shoulder long after the credits roll. The actors, with their superb performances, breathe life-or should I say, a sinister breath of the afterlife-into their characters, making every scene a haunting tableau of horror.

A Symphony of Symbols

While a few plot points were perhaps a tad predictable, let's not overlook the masterful dance with the devilish details. The movie's use of symbolism isn't just a nod to the aficionados of the genre but an intricate tapestry that enhances the narrative and deepens the lore of the Omen series.

Jump Scares and Goosebumps

Yes, the movie does make you jump-perhaps not out of your skin, but certainly enough to spill your popcorn. It's a testament to the film's expertly crafted tension and timing. Whether it's the creak of a door or the sudden appearance of a sinister figure, ""The First Omen"" knows how to manipulate its audience's nerves.

For the Fans and the Uninitiated

For those who've followed the Omen series with a dedicated heart, this film is a treasure trove of revelations and insights. But fear not, newcomers! This prelude serves as a fantastic entry point into the series, offering enough context to stand alone while sparking curiosity about its successors.

Rewatchability Factor

I'm already planning to dive back into the dark world of ""The First Omen."" The impact it had on me was profound enough that I intend to rewatch the entire series in its newly established chronological order. It's a testament to the film's allure and its ability to weave new threads into the existing Omen tapestry.

The Verdict: A Hellishly Good Watch!

With a score of 4 out of 5, ""The First Omen"" is not just a movie; it's a cinematic séance that conjures the very essence of horror. Whether you're a devout follower of the series or a fresh-eyed explorer in this dark domain, this movie is a compelling invitation to delve into the shadows.

So, dear readers, if your appetite for horror is as insatiable as ours, give ""The First Omen"" a watch. Who knows? You might just find yourself under its malevolent spell, eager to uncover more dark secrets in the subsequent films.

Remember, in the world of ""The First Omen,"" every shadow tells a story, and every chill down your spine is a verse in its unholy scripture. Dare to decode it?",8.0,10 April 2024
An Ok Movie But A Bad Prequel,,4.0,3 June 2024
Very good,"Cinematography: The film opens strongly, immediately capturing attention with its use of cinematic techniques. The diversity of camera angles, including various shots from inside a car, complements the film's visual narrative. The use of medium closeups enhances the emotional intensity of the scenes.

Editing & Pace: The editing is competently executed, maintaining a slow pace that is intentional but may not reveal its purpose until later in the viewing experience. The slow-motion sequences are particularly effective, creating a palpable tension that's both engaging and innovative. This slow unveiling contributes to a sense of mystery, although it occasionally borders on creating confusion regarding plot developments.

Sound Design: The sound design is a standout feature, similar to iconic films like ""2001: A Space Odyssey"" and ""Dune (2021)."" It skillfully incorporates elements such as glass and ring sounds with gospel music in a Shepard tone, alongside whispering chants and groaning that sound very rich. The soundtrack also unexpectedly mixes cinematic scores with funk and disco music, adding an original twist.

Performance: The performances are a major strength of the film. One actor, in particular, brings a notable depth to their role, especially the voice, and the main protagonist delivers her performance impressively. The cast's ability elevates the mature and well-developed script, making even predictable moments engaging.

Plot & Script: The plot is well-crafted with rich details, although it bears similarities to ""Immaculate (2024),"" which makes the structure somewhat predictable in the first two acts. However, the third act introduces unique elements that set it apart. The dialogue is sharp and contributes effectively to the development of the storyline, ensuring that each character's voice is distinct and meaningful. Hence, I prefer writing for this film than ""Immaculate"".

Special Effects: The CGI is commendable, enhancing the film's horror elements without relying too heavily on jump scares, of which there are only a few minimal instances.

My Critique: While the film excels in many technical aspects, I struggled with clarity in the first two acts, leaving too many ambiguities unexplained. Additionally, the predictable plot elements due to its similarity to ""Immaculate (2024)"" may diminish the impact for some viewers, although the film tries to go in a different direction in its final act.

Conclusion: Overall, ""The First Omen (2024)"" is a film that impresses with its technical execution and strong performances. Despite some narrative shortcomings and pacing issues, it offers a fresh take on traditional elements, making it a worthwhile watch for fans of sophisticated horror and thriller genres.

Rating: 8/10.",8.0,12 April 2024
Dick Van Dyke,"Well, after many, many, many year's, Dick Van Dyke can relax. I can reveal, EXCLUSIVELY, that the accolade for worst accent is now...tralala, big reveal.. Ralph Ineson. Who can forget good old Dick and his ""Cockney"" accent?. Well, you can now. Ralph and his ""Oirish"" accent is head and shoulder's the clear winner. An Oscar beckons. Now, where was I?. Ah yes, the new Omen movie. Supposed to be a prequel. It could be, but I lost the will to live at the 35th minute. I've hung around Rome, but I have NEVER seen a drunken nun, or novice, nor one who wear's skimpy attire. Perhap's I should have visited downtown Rome?. Anyhow, the movie is a waste of time, space and oxygen.",1.0,26 April 2024
Cinematography and Acting - 9,,9.0,2 June 2024
Too much drama,"Doesn't live up to the original. It would be a decent movie if you like drama and never watched the original. Not worthy of the title. I wish they never made it lol. I guess I have to write more for it to be accepted. I guess I could tell you how disappointed I am. I waited a long time to see it. Oh my goodness I need 300 more characters????? I will tell you that they tried to rip off a few scenes. They could have done so much better.

So today I had a cheeseburger and cheese fries. I'm not really sure what else to write about. I loved the first omen movies. Even the remakes. This is poooopy!

Yes!!! I made it.",1.0,2 June 2024
The first movie since the first that's made me react,"I don't normally review movies and once you've read this you'll know why I expect. However, I felt compelled after watching The First Omen. This is the first movie I've watched since the original movie that made me feel the way Richard Donner's movie did. It doesn't rely on jump scares (although there are a few) instead it builds tension and has some simply wonderful cinematography and imagery, there were times, I felt I was watching a David Lynch film, bizarre, creepy and often odd I absolutely loved that it didn't feel the need to explain absolutely everything up front. T builds to a wonderful conclusion, perfectly preludes the original and best, and leaves the door open to explore the Omen universe in new exciting ways. Something I hope this director gets the opportunity to do. It's only an 8 out of 10 for me because I'm old school and was hoping for one or two more grisly deaths but that's just me. I highly recommend. The best movie I've seen so far in 2024, well done all involved.",8.0,28 May 2024
Don't waste your time.. 120 minutes of non sense,"A real disappointed, the movie is trying too hard to scar you. The story does not make any sense at all.

The movie has gore and disgusting scenes more than pure horror or scare jumps.

People in the cinema started to leave in the middle of the movie and I regerted not to leave with them.

The acting is so bad, the music pitch is high, disturbing and does not match with the movie.

I think the aim of the movie is to show nuns as bad people who smokes, go out to have fun and get drunk. For a prequel I expected to see something similar to the conjuring. But the whole movie is a saw wanna be..

Avoid this non sense.",1.0,11 April 2024
A well done prequel with great atmosphere,"This film nails the right aesthetic of the 70s.

It starts strongly building tension even if most people know what's coming.

Yes the plot has some immediate similarities to the Sydney Sweeney starring Immaculate and it's a strange coincidence both movies were released so close together but The First Omen does have its own way of doing things.

The acting is mostly excellent and Nell Tiger Free excels in her role.

Whilst I wouldn't say it's a very scary movie there's definitely some yucky bits and the ending is pretty good compared to most horrors on offer at the moment.

This comes across more of a thriller/religious drama but it moves along swiftly without much filler and is definitely worth the time to watch it.

I'm giving it an 8 because although it's not groundbreaking there's nothing actually wrong with the movie therefore I want people to be prepared to give it a go.",8.0,2 June 2024
Horrible!,"Please do not waste your money, just wait, it'll be on Netflix in less then a month. It was slow, boring, and not even a little scary. I don't know why I keep giving movies a try. Unless it's extremely big budget, don't bother, it'll be streaming on all platforms in no time. This was an absolute embarrassment to the first movie, how dare they? I just want to know why horror has taken such a nosedive, it's beyond disappointing and underwhelming. Again I repeat, save your money! I don't need to explain why it was so horrible, but given the track record for horror movies since covid, it should be a given that it wouldn't be good, but I still wasted my money, I'm just hoping you dont.",2.0,14 April 2024
