review_title,review_body,rating,review_date
Brilliant Dramedy With a Shocking Finale,"Do The Right Thing is perhaps the best case study of racism ever made. Some people claim that the film perpetuates black stereotypes. Some people don't think. The black people in Do The Right Thing, like the white, Hispanic, and Korean people) exhibit all the unfounded fear and rage that stems from racism. The only truly stereotypical black man in the film is portrayed as an idiot. Buggin' Out sets the whole thing in motion because he is outraged that the local Italian-American pizza man Sal doesn't have any pictures of African-Americans on his wall. He spends the rest of the film trying to gain support for a boycott of Sal's. The rest of the predominately black neighborhood rightly views him as an idiot.

Spike Lee himself plays Mookie, the closest thing to a protagonist in the film. Mookie is a lazy delivery boy at Sal's who has a girlfriend and a baby that he doesn't support. Samuel L. Jackson plays the local DJ who is ultimately the voice of reason in the film. There are a slew of backup characters, nearly all of whom play important roles. Radio Raheem, Da Mayor, Sal's sons, Jade, and many others are vital to the film.

If I had to guess why some people don't like this film, I would say it's due to the fact that there are no good guys. There aren't even any bad guys. There is no one to root for because everyone is guilty. Spike Lee's magnum opus examines the deterioration of characters incredibly. You can feel the characters wearing thin as the hot day drags on and tension mounts. The only flaw of the film is that the subplot of Mookie's relationship with Tina flip-flops, but even that is for a purpose. Don't let the handful of vocal naysayers keep you from watching this indie masterpiece.",9.0,26 October 2007
"Creative, but definitely not flawless","It's sometimes difficult to separate artists' public statements from the work they're commenting on, or to ignore the politically charged aura a film generates. There's always that nagging feeling that a movie's point must be sussed out, that the real intentions of the filmmaker must be understood. But in retrospect--and despite director Spike Lee's rhetoric--Do the Right Thing may not be as profound as previously thought. While it should be applauded for taking on the subject of race without Hollywood's usual heavy-handedness, simply presenting a topic doesn't automatically mean anything is actually being said about that topic.

Whatever problems there are with the content, Do the Right Thing is still great film-making. It's a vibrant, passionate, funny movie, and like a true work of art, it both surprises and provokes. It's technically audacious and features one of the most successful displays of stifling, suffocating heat ever put on film.and it does it without being languid itself. The dialogue is fast paced, the characters energetic, and the camera-work unpredictable, full of clever pans and Twilight Zone angles. And, except for the always excruciating Martin Lawrence, the performances are uniformly good throughout. Lee also manages to out-Altman Altman by presenting a large cast of characters without it ever becoming confusing or disjointed.

Taking place over the course of one scorching day in Bedford-Stuyvesant, most of the action occurs in and around a pizzeria run by Sal (Danny Aiello) and his sons Pino and Vito (John Turturro, Richard Edson). But the entire neighborhood is featured as the film intercuts between various exchanges, many of them tinged with racial overtones: while Buggin Out (Giancarlo Esposito) challenges a white tenement owner when he feels slighted, down the street three men debate the right of a Korean to own a variety store in ""their"" neighborhood.

There are personal moments as well: Da Mayor (Ossie Davis) continually attempts to soften Mother Sister's (Ruby Dee) opinion of him, while Mookie (Lee) juggles time between his job at Sal's and his increasingly aggravated girlfriend (Rosie Perez). Although Lee doesn't have the time to make all his characters three-dimensional, he avoids sentimentalizing or demonizing any one group; there are both blacks and whites who are sympathetic (Sal, Da Mayor) and troublesome (Pino, Radio Raheem). Only the Korean storeowner played by Steven Parks is a blatant caricature. (Asians seem to get short shrift no matter who is behind the camera.) Presiding over the action is disc jockey Senor Love Daddy (Samuel L. Jackson). Like Wolfman Jack in American Graffiti, he provides ongoing background music, as well as periodic commentary.

Eventually, the heat and personal tensions culminate in an explosion of violence centered on Sal's pizzeria. The violence escalates after one of the characters is killed. It's at this point that the film becomes problematic. The murder is supposed to be a tragedy, meant to provoke outrage in the audience. But the killing of a fictional character isn't enough in itself to warrant a reaction. It's not that audiences are jaded, but drama usually elicits judgement based on the narrative alone. If a character is a jerk, his death won't elicit much of a response. Like Mel Gibson's The Passion of the Christ, Do the Right Thing relies too heavily on the personal baggage audiences are supposedly bringing to the film. Drawing on contemporary events and feelings may be provocative, but it dates the film and makes for poor drama. The reactions of Mookie and Mother Sister to the murder may have been understandable to a disenfranchised group, but in the context of the plot they appear unmotivated, almost random.

The somewhat ambiguous nature of the movie could easily be trumpeted as a selling point. Lee doesn't want to hold your hand; he wants you to make up your own mind. But there is a fine line between ""bravely ambiguous"" and ""maddeningly directionless."" While Oliver Stone continually has been pilloried for his blatantly didactic films, there is something to be said for being recklessly personal and taking a stand. Lee made a movie about racism; but we're so starved for challenging works, for thematically mature movies, we've embraced a film that ultimately says nothing more than ""racism is bad"" and ""no one person or group is to blame.""

The simplistic ideals of Do the Right Thing are most evident in four scenes: 1) Love Daddy lists practically every major black musician from the last fifty years; 2) in an overly contrived sequence, Mookie gets Pino to admit that his cultural heroes are all black (Magic Johnson, Eddie Murphy, and Prince); 3) Martin Luther King, Malcolm X, Al Sharpton, Jesse Jackson and Louis Farrakhan are all mentioned; 4) the words ""Tawana Told the Truth"" appear spray painted on a wall (a reference to the Tawana Brawley controversy of 1987). No differentiation is made between the listed artists, and no context is given for the black leaders mentioned. These aren't explorations of racially-charged issues, it's just name dropping.

Despite its flaws, Do the Right Thing provokes discussion. It's an impossible film to dismiss. Spike Lee's subsequent career has turned out to be a disappointment, but Do the Right Thing, along with Malcolm X, represent Lee at his creative peak.",7.0,22 June 2006
Do the Right Thing (1989),,7.0,10 May 2011
There it is..... Love and Hate,"90% of Spike Lee's masterpiece Do the Right Thing is a perfectly developed character study of a wide range of model personalities who all happen to be in Bedford-Stuyvesant on the hottest day of the summer. What the other ten percent consists of you will have to discover for yourself.

This ingenious film explores extremes, but never gives itself over to stereotypes as its plot cleverly navigates through the politics of inner city life and the struggles of American racism. As an artful and intelligent examination of the ethics of violence and prejudice, Do the Right Thing is unparalleled. It implies a simple profound question - what is the 'right thing'? But steadfastly refuses to supply even a hint of an answer - appropriately leaving its central point entirely up to its audience. Instead, the film points to a different, perhaps more important question ""Whose version of right is right for you?"" There are a lot of good people, a lot of bad people, and a very realistic majority of people who are usually somewhere in the middle but also somewhat confused throughout this film. African American, Latino, East Asian and Italian American cultures form the dynamics of the relationships that drive the story, and conflict is their medium. Drawing from two incisive but different comments on violence from Martin Luther King and Malcolm X, Lee extrapolates his story and the ideas he wants to explore by showing us characters that are as real as they are exaggerated and somewhat unpredictable events that they create, are swept into or actively or passively participate in. Although the point of the film is not really critique, nobody is left unscathed.

I am not going to tell you what the film says - I can't, because it is, more than most films dealing in such a direct manner with the subject of race, open to interpretation. And what you bring to it will influence, but not determine what you take away from it. It is just that powerful.

Instead, I will simply give Do the Right Thing my highest recommendation.

Superbly written, edited, directed and filmed. Well acted (Danny Aiello, Ossie Davis, Giancarlo Esposito, Rosie Perez, Spike Lee and Richard Edson really stood out for me) and very nicely soundscaped, Do the Right Thing is the perfect film for a solitary night of reflection or for sharing with an intelligent group of friends. However, be forewarned, the film hits hard, and will disturb some people a great deal - especially those who feel a need for closure and resolution.",10.0,28 February 2008
"That's the double-truth, Ruth","In all likelihood Spike Lee's most important achievement - as director, writer and actor (though to my taste Mo' Better Blues is just as good a picture) and one of the strongest films you'll see about race relations, 'Do The Right Thing' looks dated at times, but it lost none of its impact and relevance. The movie takes place in a particularly hot day in a primarily African-American neighborhood in Brooklyn, and follows the various personalities who live there throughout the day; the center of the story is Sal's Famous Pizzeria - its owners, some of the few white people living in the neighborhood: Sal (Oscar nominated performance for Danny Aiello) and his two sons (John Torturro and Richard Edson), and Mookie (Spike Lee himself), the black delivery boy. What starts out as a light, entertaining movie with some amusing characters and light humor, gradually builds up tension to the point of being unbearable, up to the dramatic and tragic climax. Spike doesn't put as much emphasis on the characters themselves as he does on the relationships and the tension between them; and in this image of a very specific and small frame in time and place, makes a strong and important message about racism and race relations in general. The film is populated with many different characters, all of them very memorable and each one a representative of a certain belief, mode of behavior or state of mind - on both sides of the conflict. From the uninhibited anger of Buggin Out (Giancarlo Esposito) and Radio Raheem (Bill Nunn) on one side and Pino (John Torturro) on the other side, to Jade (Joie Lee, Spike's sister in the film and in real life) and Vito (Richard Edson), who are trying to connect and live at peace with the other side, to Da Mayor (Ossie Davis), in his isolated but peaceful state of mind, living in complete peace with the world around him, and Smiley (Roger Smith), living in his own isolated existence. Then there's Mookie, who is stuck in the middle, torn between his commitment and responsibilities to both sides. Finally we have Mister Senor Love Daddy - played gorgeously by the one and only Samuel L. Jackson, in one of his finest performances - half active character and half all-knowing narrator - who represents the voice of reason in the conflict, the reason which is bound, ultimately, to collapse. Each and every character plays an important part in the climatic and dramatic conflict to which the movie builds up, and though it's the radical ones - Buggin Out and Radio Raheem - who trigger the events that cause the tragedy, they are not necessarily the ones who finish it. It is Mookie and Sal, in fact, who ultimately play the main part.

Do The Right Thing is not an easy watch; it's a mesmerizing, tense, difficult film that breaks many taboos and slaughters many holy cows. But in the end of it - hopefully - you'll be wiser than you were in the beginning, and that's what Lee have always tried to achieve in all his films. Watch it to get a real view on racism that doesn't duck the difficult issues and isn't afraid to tackle the real problem, and to see a master director at work. It's one of the best films of its time.",10.0,24 May 2005
Spike Lee's best work! A mind-blowing masterpiece of cinema! @,"""Do the Right Thing"" is a powerful, uplifting, visually stunning masterpiece. It's a movie that I can watch over and over again, and deservedly takes the Number 7 Spot of My Favorite Movies Of All Time. This was one of Spike's debut efforts, and until this day--the best one. Spike gives us an honest, unflinching look at the Bedford-Stuyvestant area of Brooklyn on the hottest day of the summer. He perfectly displays the racial tensions that go on between everybody from blacks to whites to Koreans. Yet he never gets preachy, which is one of the brilliant things about this movie. Some of Spike's best work is demonstrated in his shots of Radio Raheem, played excellently by Bill Nunn. RR doesn't say much, but he has this violent gaze which sums up his feelings without a word being said. Spike gives us some great angles of his face, demonstrating the pure rage brewing inside of him. He also has a great scene in which he sums up the meanings of love and hate, in Spike's trademark poetry-in-motion style. RR constantly carries around a boombox, playing the same song ""Fight the Power"" by Public Enemy. That song is one of the best musical themes in movie history, perfectly summing up racial tension among inner cities. This movie doesn't tell its audience that black people are better than others, nor does it say that Hispanics are, or whites, or Asians. It just gives us a raw look at what happens when we let racial quarrels get out of hand. We learn how sometimes it's appropriate to preach against racism, and sometimes we're just overreacting.

The cast is terrific, and they deliver memorable performances. I really wish Danny Aiello picked up the Oscar for his role as Sal, because that is definitely the pinnacle performance of his career and one of the best I've ever seen. Other noteworthy performances are by John Turturro, Ossie Davis and Giancarlo Esposito.

The film is put together with such fast-paced editing that it doesn't once get boring, doesn't have any low points. This is a gritty, memorable film that I wish can be considered more prominent in the eyes of the average moviegoer, because it really deserves great recognition for its unique, unforgettable style.

Spike definitely knows how to do the right thing.

My score: 10 (out of 10)",10.0,30 April 2001
An underappreciated masterpiece,"I find it a tremendous oversight that this film gets so little recognition. The American film institute couldn't find one place in one hundered American films for this cinematic masterpiece that pulls no punches . It got no academy award and most importantly I could not find one friend who had heard of it. I call this a tremendous oversight because the film is wonderful. I know that Spike Lee is a rather eccentric personality and is not well liked by everyone, but his films are brilliant and this is no exception.

For about the first two thirds of the movie the plot meanders around a section of New York City as the characters awaken and start their days. For this first two thirds we have a comedy that is funny because of the eccentric and wonderfully developed characters. The audience is pulled into the story by the rich dialogue and inventive cinematography. There is just some quality about this film that makes it seem so real. This all sets up for the imminent tragedy to be all the worse as a result of the connection the audience has with the movie.

Then the film explodes. Those who have seen it know what I mean and those who have not should see it. This last third of the film should not be explained, it must be experianced. In fact this whole film should be experianced. I can't say enough.",,20 April 2000
practically the definition of a must-see movie,"I have heard people describe Spike Lee as a second-rate filmmaker; all I have to say is that second-rate filmmakers do not make films like this. Do the Right Thing is a masterpiece in both style and substance, and Im hard pressed to think of a more powerful, earth-shattering film.

But first, let's talk about the style. The color palette of the movie is wonderful; while its mostly deep reds, they manage to bring home the feeling that the residents of Bed-Stuy must have been feeling on that day. The cinematography is excellent... it features a lot of weird viewpoints and angles, but they are used to great effect and manage to work within the style of the film. One thing that really managed to impress me about the film is the razor sharp dialogue... each character has their own style of talking, and it really works well. This is a masterfully written film.

Now the substance... this movie manages to spiral into a truly spectacular ending. Throughout, its easy to see the necessary elements building, and, when it happens, it hardly seems like a surprise, but that doesn't make it any less shattering. The way that each character acts defines this movie throughout, especially at the end! Spike Lee does a brilliant job here. The movie is interesting and well-made throughout; each of the characters are three-dimensional and feel like real human beings - their motivation is understood throughout.

Do the Right Thing is a brilliant movie that never lags and never lets up. It manages to be vastly entertaining and vastly powerful at the same time. It's truly an amazing achievement in film, and its a shame it was not recognized more for its obvious brilliance when it was released in 1989.",10.0,6 April 2001
"A Brilliant Film, Though Controversial",,7.0,11 August 2008
Cruel reality meets light-hearted comedy,"I went to see a free showing of this film the other night, in light of recent events. Where a younger version of myself would have maybe shrugged and thought 'Well, this is an extreme depiction of reality', I now realize that it is not.

Do the Right Thing is a beautiful mix of comedy, great narration (what movie introduces an entire block of characters and makes you care about each of them?), intense dialogue and a very dark, grueling reality we live in, today. Not just in the United States, but everywhere in the world.

Unfortunately it cannot be fully called a historical drama yet. But hopefully, some day in the future we can watch this, have a chuckle and weep tears of sadness for the past in which racism, prejudice, bigotry and police brutality was commonplace. Until then: let's spread this movie out like a virus. It's been 30 years with hardly any change, the previous generations haven't been able to eradicate the evil that is racism. Let's do our best to make a difference.",9.0,10 June 2020
Great film but the message is mixed,"As a non white or non black person my self I view this film from a different perspective as I can't relate to either community. I understand Lee's message and point in the film and even after 30 years after the release, it is more relevant than ever. But for the character of Sal, he is punished for standing his ground. Should he have racially abused black people based on their race, no. But should he have been given the blame for the death of a black man, no. If Raheem killed Sal, which is definitely what he was trying by strangling him, the black community in the film wouldn't have been guilty for his death and say he deserved it. All he did was brake his radio. Sal saying that he only puts Italian American people on his wall is completely justified as he comes from a Italian heritage. If a white man entered the restaurant of a black man and said put up pictures of white men that wouldn't be seen as right. And it applies for both races, just because he is a white man doesn't mean he should be punished. Mookie's decision to boycott the restaurant and allow for the rest to burn down Sal's restaurant has no justification. I didn't understand Lee's point, was he trying to make black people look worse of better? To me it only represented what Americans think of the black community.",7.0,2 April 2021
The Boiling Point,"A scorching summer day brings racial tensions to their boiling point in a Brooklyn neighborhood. Seen through many points of view Spike Lee paints a convincing and critical picture of tensions in the most diverse city in the USA.

The film's strength is its ability to ring true to many sets of ears and especially if you frequent or live in a big city. You always here of events - big and small - on the news and there is usually that element of ""racial tensions"" or ""possible racial motive."" In a city where over 200 different languages are spoken (which can give you an idea of how many distinguishable cultures there are) it is only a natural ingredient for friction between people. Whether you hate the other guy, or are just annoyed that you can't understand him nor he you, when all you want to do is buy some groceries. This film shows many situations of this type and how everyone is, in a sense, innocent and guilty at the same time. If a situation gets out of hand and you have people throwing slurs at each other there is that famous expression: ""he crossed the line."" Well even with critical hindsight, this ""line"" isn't always visible and when it is, it's faint.

Spike Lee manages to show that very well and with a lot of diverse characters, hence the film being able to ring true with an equally diverse audience.

The only problem is that in today's America the issue is more about class and not just race, though race and class are intertwined. ""Crash"" presented the issue of class and lifestyle a little bit more thoroughly, but in the end felt preachy and unrealistically sentimental. ""Do the Right Thing"" is much tighter and the film's climax and overall impact is more powerful. Also of the note is the terrific acting from the entire cast. --- 9/10

Rated R for profanity and some violence",9.0,8 December 2006
A Mediocre Look at Serious Issues,,6.0,20 September 2000
"Provocative, Explosive Greatness Wrapped in a Muddy, Hateful Cloak",,5.0,8 July 2020
excellent drama with a message,"If I had to make a list of the top ten things that I find most boring, racism would be right at the summit along with economics and The Blair Witch Project. For that reason, I have avoided Do the Right Thing up until now for fear that it would be a lecture on racism...but actually, I don't know what I was afraid of, as this film is really good. Spike Lee's racial drama is actually more a film about the feebleness of racial divides and how violence only breeds violence, as opposed to a film ABOUT racism. In fact, the film can be best described as a cinematic materialisation of Martin Luther King's famous ""an eye for an eye leaves everybody blind"" speech.

For this movie, Spike Lee has put together a terrific cast, that includes many actors that have gone on to become big names in the movie industry, people such as Samuel L. Jackson, John Turturro and Martin Lawrence, not to mention smaller stars such as Ossie Davis. The cast comes together excellently and the neighbourhood that Spike Lee has created for this film feels very real, and through the multiple personalities that inhabit it, it manages to stay interesting and realistic throughout. The atmosphere of the neighbourhood is also of note, and you really do get the feeling that someone could say 'biatch' or 'dogg' at any time. Spike Lee delights in showing us many different people, and at different times - including their reactions to certain events and their interactions with each other, and it all helps to build up both their own characters and the neighbourhood that they live in. This proves to be invaluable to the film as it has no real plot and therefore relies on the characters and the neighbourhood that it has created to build itself, it's scenario and therefore it's message, up.

Do the Right Thing is a portrait of how multiple cultures live together in modern day America and it also succeeds in being a stark and potent portrayal of how violence never gets anyone anywhere. Spike Lee has shown his talents as an actor, director and a writer with this film, and even though majority opinion of him seems to be that he's a disagreeable old crone; at least he's one that has talent.",8.0,10 December 2004
A masterpiece full of sound and fury,,10.0,5 December 2001
