review_title,review_body,rating,review_date
"Important, Smart & Unforgettable!","How often do we see a film as powerful & engrossing as 'Do the Right Thing'? I mean this was way back in 1989, when Producer/Writer/Director Spike Lee blew up the big-screen with a hard-hitting, gut wrenchingly honest story on racism, that, sadly, remains timely to this day. And despite choosing a subject as grim as this one, Lee, the genius, presents it like an entertainer, that never comes across as a lecture or a depressing experience. It roars without ever screaming at your face!

'Do the Right Thing' Synopsis: On the hottest day of the year on a street in the Bedford- Stuyvesant section of Brooklyn, everyone's hate and bigotry smolders and builds until it explodes into violence.

'Do the Right Thing' is about people engulfed with hate & pressure, despite having the ability to 'love'. Spike Lee delivers an important, smart & unforgettable tale on racism & its pointlessness, with interestingly diverse characters, right from White, Black, Italian & Asian. Lee has Written each character with a distinctive personality, thus, making them all interesting, a few even being memorable.

The climax here is a reflective & provocative one, one that truly asks you the question - Why is this happening & if there is a problem, is the solution always this ruthless? I won't give away spoilers, as there might be some readers out who are yet to see this film. But, Lee's question in the finale will throw you in a tightrope & you'll have to figure yourself who actually you stood for & why. Its truly thought-provoking!

Lee's Writing is masterful. His Screenplay is among the most important ones Cinema has Produced. Its intense, intelligent, volatile & entirely engrossing, all at the same time. Lee's Direction is Fantastic. He has handled this terrific film, with a touch of realism, that's so rare in movies nowadays. Special Mentions for Ernest Dickerson's Cinematography, Barry Alexander Brown's Editing & The Excellent Art & Costume Design.

Now coming to the Performances: Lee shines an an actor as well. He embodies the central part with unmistakable honesty. But the show- stealer here is undoubtedly Danny Aiello. In his portrayal of Sal the pizzeria owner, Aiello is simply astonishing. Right from his body-language to his powerful dialogue delivery, Aiello offers a true acting masterclass! Its among the finest performances of all-time & there is no exaggeration here!

Of the rest of the cast, John Turturro is remarkable as Aiello's conflicted son Pino, while The Late/Great Ruby Dee is haunting as Mother Sister. The Late/Great Ossie Davis as Da Mayor, is wonderfully restrained. The Late/Great Bill Nunn is excellent & Rosie Perez as Tina, in her breakout role, is feisty. Rest lend great support.

On the whole, 'Do the Right Thing' is a powerful piece of modern cinema. Its a film that demands your attention, asks you questions & never forgets to keep you engrossed. This one's a MASTERPIECE!",10.0,7 August 2017
"The Right Thing, Eh?","Any piece of film that leaves you asking questions about yourself and your own morality has certainly done the job it's intended to. And in Spike Lee's seminal 1989 slice of life drama ""Do the Right Thing,"" Lee forces us to ask ourselves what exactly that right thing is.

Lee plays the main character, Mookie, as he struggles through inner-city life working for a somewhat racist Italian pizza shoppe owner. When an altercation at the pizza place leads to a death of Mookie's friend, and racial tensions rise, Mookie is left with no choice but to start destroying the pizza place, lest the angry mob turns their hatred towards the actual owners.

In that space, Lee challenges us to wonder if what Mookie does is right. The film itself portrays the in-your-face nature of an entropic urban project, complete with homages to 80's rap videos of the day and graffiti of the town's one and only hero, Mike Tyson. That in it of itself should explain what's wrong with the town, but Lee challenges us to look further than surface level.

And that's what this film does so well, is make you believe that this is almost a documentary, not a stylized film. And in that, Lee succeeds tremendously.",9.0,10 May 2010
A Spike Lee instant classic1,"I watched this film again recently for the ninth time and still think it's one of a truly talented director's best.I myself am a huge Spike Lee fan and i have recently watched '25th hour'which i feel is already one of my all time favourite films and knew that as soon as i saw it and i just thought how funny it is that Spike has never made a bad film!i mean are there any bad Spike Lee films? all have been amazing right from '25th hour'right down to his first feature 'She's gotta have it'which was back in 1986. It just makes you think what an amazing film maker/storyteller he is and 'Do the right thing' is a perfect example of that. This is such a powerful movie and is probably the best when it comes to the subject of racial tension between whites and blacks living in the same neighbourhood, the acting is also amazing even when it was the roles of newcomers such as Martin Lawrence,Rosie Perez and even Sam Jackson.But my favourite is still Bill Nunn who plays the ultra cool 'Radio Raheem'.Amazing.10 out 10.",,22 December 2004
"""Do the right thing.""","A statement, just as plain as any. But when particular circumstances arise, or situations occur, are packed full of meaning. In the film, the title is actually said, and the decision is felt by all in the neighborhood. The way Spike Lee isn't afraid when it comes to dialogue, and his portrayal of the human situation is what made this film great. Because, instead of having this film being an ideal or a ""portrayal"", his film I can feel is the real deal. Many portrayals nowadays take artistic liberties or clean something up to make it more appropriate for viewing audiences, or more intense to shock them. Even though this film was made over 20 years ago, with the recent spike of public interest in the ""Black lives matter"" movement, we can all connect to this film in someway. Whether we are taking direction or passive action, standing up and observing, or simply just having a stereotype or certain ways of thinking and feeling expected of you due to the color of your skin. In this film, we have Mookie. He's African American, and everyone at his job, is Caucasian. The owner as well as the owner's sons/employees. There's a Korean mart across the street. And the neighborhood is predominantly occupied by African Americans. So in Lee's film, he explores the tension and day-to-day interactions by this close proximity of mixed skin colors and races in his 1989 film, Do The Right Thing.",7.0,10 May 2016
Painfully Inspiring,"""Do the Right Thing"" (1989) is a comedic drama about racial tensions in Brooklyn, New York. There are several notable characters in this film, but Mookie, played by Spike Lee, has the spotlight. When I originally watched this film almost 20 years ago, I felt a sense of pride that the black community stood up. When watching it today, I feel anger in my compassion because I sincerely believe that had everyone spoke with a little more respect to one another, the tension would have been slighted resulting in an alternate ending. Overall, my emotions don't affect my opinion of this being an outstanding film.

Spike Lee is an amazing writer and director that puts the hard truth on the big screen for the world to take notice. This film is the epitome of not only what was happening then, but what is still happening today. The acting was mostly spot on for the era and location, but the exception is Spike Lee himself. He appeared very stiff and out of place through most of the film, but it didn't detract from the message. His multiple uses of unconventionally canted shots added a complex level to the scenarios that adds tremendously to the story. Even though watching this film now hurts my heart, it is a classic that should be viewed by everyone, particularly those who need an inside look into lower class minority communities.",9.0,25 July 2018
Do The Right Thing,,7.0,8 May 2014
"Not Just Brilliant Filmmaking, But a Reflection Of Our Times",,9.0,19 June 2020
Good movie,"After seeing this movie again for the third time I still don't understand it, its a great movie; the acting is good, the story line is good but I just can't seem to figure out the message that this movie has. During the scene where Mookie breaks the window I'm not sure if he did that to get the crowd from attacking Sall and his sons or just to release his own anger. The message of the movie just completely goes over my head because I just don't get it. When Mookie goes to get his money from Sall and gets the money thrown in his face they end up having a decent conversation or so it seemed was Sall not angry at Mookie for breaking the window or was there a underlying sense of gratitude for him not getting killed.",6.0,18 December 2012
Do the right thing,,2.0,10 May 2011
There is one film all true film fans can pinpoint as the one that changed them from someone who likes movies to someone who loves them- 'Do the Right Thing' is the one for me.,"The vibrant colors, the colorful language, the use of sunlight, the balls out techniques, the challenging situations. Spike Lee peaked with this film. He'll never make a better one, few will. I hope in 10 years it gets a big-screen re-release, cause I never saw it on the big screen. I still have a huge poster of it on my wall. If you haven't seen it, see it.",10.0,15 April 1999
Do the Right Thing,"Explosive motion picture that astounds, enthralls and moves at every turn. A true tension film that studies...almost sets the standard for an up close and personal look at real bigotry and hatred in ways no one has ever imagined. Lee sculpts a story of morality, of passion and of life that is so real and at times so horrific that I weep when I return to it.",9.0,28 June 1999
"You'll laugh, you'll cry, you'll definitely be moved","I was sitting in my high school film class one day and my teacher mentioned we would be watching Spike Lee's ""Do the Right Thing"" to help us [students] understand racial perspective in film. I didn't think much of it at first, but when he finally put the tape on, I don't think I can ever forget this film.

Spike Lee takes you into brooklyn like no other director has. Through very extreme (but very real) characters, Spike shows you that no matter what, there are and will always be prejudices, but that they can be overcome. I can honestly say that it is one of the most disturbingly real and moving movies ever made. I've never laughed so hard and I've never cried so hard.

I encourage anyone to watch it twice, once for enjoyment, and the second time to reflect on yourself. Black or White this movie will stir up some major emotions inside. If you've seen American History X, see Do the Right Thing and see how a black director portrays racism. If you aren't moved by this film, watch it until you are.",10.0,2 July 2001
My Favorite Movie,"Spike Lee's film opens with an incredibly long opening credits featuring a woman (Rosie Perez), dancing/boxing angrily at the screen with Public Enemy's ""Fight the Power"" in the background screaming. It is already clear this movie involves anger and frustration. Finally it says ""Written, Produced and Directed by Spike Lee"", and the movie begins.

It starts by showing members of the Bed-Stuy community, a multiracial but predominately black neighborhood in Brooklyn, New York. Every character is interesting, funny, and unique. It is summer 1989 and the day it takes place is on a scorcher. While every character is different, they all have the heat in common.

Soon enough tension rises between the characters and violence breaks out. The characters are all clearly biased and discriminatory between the other races, and eventually it all comes out in an intense climax.

But the beauty of the film is the almost perfect balance of comedy and drama. The first hour will have you laughing out loud, and by the second hour you are riveted, scared, and most importantly moved. The experience is unforgettable. Do the Right Thing is my favorite movie.",10.0,24 June 2008
An Amazing Film,"Many see this film as too stereotypical of the different races. But isn't that the way a lot of people saw these races, especially in the time period? The film blends the quotes from the great black leaders Martin Luther King, Jr. and Malcolm X. When is violence OK? Many say never...especially in present day. But put yourself in that area in that time period and with all the messed up stuff that was happening to the African American race. White cops killing black kids and getting away with it. Multiethnic neighborhoods ridden with crime and poverty and no one doing a damn thing about it.

I think this is one of the most amazing films ever made. Spike Lee doesn't give you any answers...he leaves it to you to decide whether Mookie was right or wrong with his actions. Any film that leaves you pondering for hours and hours on end is extraordinary.",,29 November 2004
Really good.,"Really really good film. This is one of the few comedies that turns ugly and is completely understandable. Let me explain- it's about Race. In Brooklyn, on the hottest day of the year. It starts out very funny, this was back when Spike Lee was still kind of charming like Woody Allen, and then it kicks you in the head! It turns really ugly, but by then you already know and love most of the characters. Featuring a star making performance by Rosie Perez, and great work by everybody in it, this is Spike Lee's best work I think. The music is a little heavy handed, but even that worked for me in this film. Rent it!",7.0,28 June 2001
Undoubtedly One of The Best and Most Innovative Films of the 1980s,"Spike Lee has been up and down as a director, but this film is clearly one of the best of the last few decades, and cements Lee's place as one of the most talented contemporary directors. Although far from perfect, and with a pop element which may render it more of a period piece than a classic, nevertheless, from the script to the editing to the camera work this film is freshly uncliche and innovative from top to bottom.",10.0,21 February 2000
"Biased, but Powerful, Film",,7.0,18 May 2012
I think he did,"As I sat in the gymnasium watching a generic presentation on violence in America, on how racial hate leads to violence, I said to myself, ""We'd all be a lot better off watching Spike's 'Do the Right Thing' instead of this no-effect propaganda."" That first time I saw it (Do the Right Thing) was one of those rare film experiences, not one that left you in awe or amazement, but one that really made you question the morality and decency of the human race. And the great thing is that it did exactly what that presentation I saw in the gym didn't do, it had you look within yourself and ask those questions: ""Do I contribute or do I try and stop it? Or do I just let it slide and keep on living my seemingly undisturbed life?"" I live in a part of New England where these issues don't really affect me, so I really could not say. But then I realized that that was a cop-out, kind of like how one of the three black men on the street corner in Lee's film says how he's tired of the excuse that they don't own a store because they're black. Well I got tired of doing the same thing when it came to racism: it doesn't affect me. Very few films can change one's ways of living, but this one does. Spike Lee's film will always be an extraordinary work of art. Like Steinbeck's 'Of Mice and Men', it asks us to look at ourselves and examine the way we live: how we judge, act towards one another, discriminate and so on. If ever you really want to see a film that is social consciously effective, then 'Do the Right Thing' is one of the most important to experience.",10.0,27 February 2002
Do the Right Thing,"There were parts I liked in Do the Right Thing and parts I didn't like. The camera had kind of a red tint to it throughout the movie that I noticed, probably to show how hot it was I'm guessing. The movie takes place in Brooklyn and is about a young African American man named Mookie who works delivering pizzas at the local pizzeria owned by an Italian named Sal. Sal built the pizza shop himself and has been delivering and working in Mookie's neighborhood for a long time, a lot of the residents talk about how they grew up on Sal's food. One day while at the pizzeria, a young African American man confronts Sal about the wall of fame he has in the shop. It was full of white people and he wanted him to put some black people on the wall but Sal responded with ""when you get your own store you can do whatever you want"" and refused to put up anyone else on his wall of fame. The young man tried to get the neighborhood to boycott Sal's pizza but no one agrees to do it at first. Sal's son hates the neighborhood and wants them to movie their business but Sal refused, Sal's son and Mookie argue constantly about race and things like that. One man in the neighborhood, Radio Raheem, carries a radio around with him no matter where he goes and blasts rap music. However, when he went into sals with it blasting he screamed at him to turn it off or he wouldn't serve him. That night radio Raheem returns blasting his radio in the store and refuses to turn it off until Sal changes his wall of fame, so Sal smashed it with a baseball bat. This lead to total chaos, the neighborhood guys started fighting sal and his sons. When the police came, they grabbed radio Raheem off of sal and put him in a chokehold and ending up killing him. This just got the crowd even more fired up. Mookie even throws a trash can through Sal's window and they destroy Sal's pizzeria and set it on fire. The movie ends with Sal paying Mookie for his weeks work and the two having a talk. I felt really bad for Sal and his business being destroyed. I don't think Mookie did the right thing by throwing the trashcan through the window which ultimately lead to the complete destruction of the pizzeria. However, it was interesting to see how much that movie has in common with what is going on in our country right now with police brutality and race issues.",6.0,13 May 2015
A subtle American classic...,"Is DO THE RIGHT THING one of the few real masterpieces of American cinema to be made during the last few decades? Yep. Do the characters in the film represent heroes or role models? Nope.

I've always been amused at some of the reactions this film has provoked, most of all the offense, which ignores a psychological component of DO THE RIGHT THING that remains ever present, though far off in the background: how pain and rage can obliterate logic and righteousness, propelling individuals with untapped intellect and creativity into fits of destructive, or self-destructive nihilism. It's rather silly to acknowledge what was inflicted upon African-Americans from the 16th century to (at least) the 1960s, then expect the same people to not carry collective rage and psychological scars after the passage of a few pieces of civil rights legislation. Expecting instant forgiveness (towards white legislative saviors) after 400+ years of every kind of degradation possible is laughable. This is not to justify wanton violence - but without understanding how history can affect psychology at both individual and collective levels, you're going to be utterly lost in this film.

Seeing this process in action is where the real tension and greatness in DO THE RIGHT THING is to be found - I can't think of another film in existence that articulates this unconscious rage - a depressingly ubiquitous undercurrent in the American psyche that unfortunately seems permanent. I don't think anything shown in this film is justified or worthy of emulation, but that isn't the point. There is an underclass in urban America (not exclusively African-American either) that was written off by many in the wake of the rioting of the late 60s, and abandoned by the exodus to suburbia that also began in the 60s. This same underclass is told with increasing vehemence to shape up, prosper and restore communities that have had role models, money and intellect drained out of them in recent decades (and beaten out of them before). In such a setting, the intelligence and energy of whoever is still around will come into conflict with their own anger, resentment and confusion, and within this setting nihilism, frontier justice of a variety and self-destruction almost start to seem sensible.

As an anti-heroic film, DO THE RIGHT THING fits comfortably into the tradition of THE WILD BUNCH, BONNIE & CLYDE or A CLOCKWORK ORANGE. As with those films, the viewer has to acknowledge the humanity and disoriented intelligence of the characters, especially when confronted with their lack of nobility. Stark and raw, viewers could easily be put off by the location of this antiheroic drama in an inner city, but this is far closer to truth - for better or worse - than any bleeding-heart Hollywood credit-to-one's-race fluff.

A brilliant, complex and very subtle film if you bother to look below the surface.",10.0,18 September 2003
A Classic for All,"Spike Lee's third film, Do the Right Thing, is a true classic in every way that a film can be considered a classic. It has some of the best cinematography and uses of color ever in film. The acting is excellent, and every roll is played extremely well.

What always intrigues me about the movie is that this movie is really made to be enjoyed by everyone. This movie deals with how African-Americans are still not treated as equals in our society, and how one neighborhood deals with these racial tensions during the hottest day of the year in New York. Spike Lee does such a good job presenting this theme that everyone no matter of race, sex, or creed can fully empathize and connect with the characters in this movie. Everyone can feel the tension and understand the problems. Everyone can almost feel the heat acting as a catalyst. And most of all, we can see how abuse and hatred of our fellow man can lead great unneeded conflict.

I love this movie. This is defiantly one of the best films I have ever seen, and I would definitely recommend this movie to everyone. It really is a true classic of American cinema.",10.0,4 July 2002
An Artists Masterpiece,"Along with ""Grand Canyon"" and ""Boyz in the Hood,"" it always amazed me how prophetic ""Do the Right Thing"" became in real life. The film captures the social discontent of the time while maintaining a timeless cinematic storyline. I studied ""Do the Right Thing"" for it's visual textures and ability to gather powerful emotion, dropping down like a finely timed wave. While not intended to discard any other piece of Lee's work, this is a filmmakers masterpiece. Passion is a rare and wonderful language one rarely speaks with such fluency.",10.0,5 April 2000
one of thee greatest films ever made,"Perhaps it will take another decade or two, maybe even more, but once someone says, ""Hey, let's take another look at that film"" from that distance, hopefully it will finally get the recognition it deserves. This film is a Spike Lee film, by which I mean no other director could have made this film. No other director could have said what Lee said with this film, showed what he showed... Now, try to compare this film to any other films out there, even his own. I cannot think of one single other film out there that really gets into the issue of racism and presents an intelligent analysis of it quite so well as this one. Do the Right Thing takes on this issue of racism and shows us all the complications and complexities of it. What is the right thing? For each culture it is something completely different. And the right thing can simultaneously be the wrong thing. No character is without flaw, no character is without redeeming qualities. Someday I hope this film will be recognized for the brilliant work it is. Do the Right Thing needs to be placed up there with other similar groundbreaking or landmark films like Midnight Cowboy, Cool Hand Luke, or The Best Years of Our Lives. Spike Lee, although respected by many, is equally snubbed and misunderstood by many more. But whether he [ticks] you off or enlightens you (as he has me), he has still made an impact, made you think. And there aren't too many others who can do it quite so powerfully as Spike Lee.",10.0,9 October 2003
...A message which comes across loud and clear!,,,15 May 2001
just my honest opinion....,,6.0,8 November 2021
One of the best films of this era,"Spike Lee is the most important filmmaker of this era. When several directors choose to make commercial fluff, he has made entertaining, beautiful films with points. Do the Right Thing blew me away when I was 11 years old and showed me the power a film could have. It turned me on to a cinematic world that was beyond just laughs, just action and just plain filmmaking.",10.0,6 July 1999
one of the most frustrating films i have ever watched,,6.0,11 December 2011
