review_title,review_body,rating,review_date
very good...,,,28 February 2002
"A bit dated, but still historically important","When I first saw Spike Lee's `Do the Right Thing' in 1989, I felt like I had just experienced a revolution in filmmaking. I had, but at 15 I didn't realize that the revolution went beyond the (at the time) radically different cinematography that helped tell the story, along with the explosive dialogue. Do the Right Thing was the beginning of a wave of important African American cinema that defined its culture beyond blaxploitation. Watching it again 15 years later, its personal importance as a film that inspired me to want to study or possibly make films has not diminished, but perhaps the fire that it lights under the subject of race relations is just a bit less hot. Perhaps it is because, like with violence, we as the viewers have become desensitized in a politically correct era and therefore consider this film to be preachy because it doesn't give us the answers in a candy-coated manner. Regardless, Do the Right Thing remains a relevant film that is important to film history.

--Shelly",8.0,13 April 2004
"As a black man, I support Sal.","I did not grow up in America. As a matter of fact, I grew up in a place where brothers are more oppressed than America. One thing that I learnt from oppression is that you can't get your way through violence. Sal was an honest businessman running his business and paying tribute to his own kind in his own way. He had the right to do that, seeing that America is a free country, as I am led to believe. However, Mookie and his gang of misfits, felt that they were entitled to partake of the fruits of the fight by their predecessors(Malcolm X and MLK) in every means possible. BULLSHIT! If they wanted to influence the state of affairs in that neighbourhood, they would have EASILY done it in a civil way without ruining a livelihood that was built from scratch. Just because you are descendants of the oppressed doesn't make you any special/ deserve special treatment simply because of your skin colour. The faster you learn to adapt and act as a reasonable human being, the faster you can dominate the world.",8.0,25 December 2012
Love and hate,"The scene in which Radio Raheem tells the story of love and hate is inspired by Robert Mitchum's monologue as Reverend Powell in ""Night of the Hunter"". Smart screenwriting like this is shown throughout the film. Great cinematography is also displayed. This study on modern race relations is so accurate it is scary. Highly recommend!",10.0,5 December 2021
Brilliant,"A star studded cast, great writing and filmography. What a great movie, ahead of its time and will forever be relevant. Spike Lee is to film making what Frederick Douglass was to the Civil War era. Thank you for the experience!",10.0,1 July 2021
Excellent film,"Spike Lee's best works: 1. Clockers 2. Malcolm X 3. Do the Right Thing.

Do the Right Thing is a grand tour of Spike Lee's style of film. If you want to get a feel for what Spike Lee is all about, see this movie. Not only is it a great film, it explodes off the screen with a great soundtrack and powerful camera work. Check it out!",9.0,31 December 1998
Still Relevant Today,,10.0,30 June 2020
"The intentions are good, but Spike Lee's approach to the material leaves a lot to be desired",,3.0,22 April 2020
"Y'all better ""do the right thing"" and see this movie!","Do the right thing is a 1989 movie. It couldn't be more dated. The techincolor style is so old. And the sayings and clothes and the music are old too. But that's what makes it a classic. I saw this movie on the FX and Bravo channel. Mookie, a black guy, is a guy who works at Sal's Pizzeria, an Italian store. Mookie has a go-nowhere job as a pizza delivery boy. Pino and Vito are his sons. Pino is the older, racist son. He seems pretty decent at first----pretty-------but then his racism develops as the time goes on, but then on the other hand,all his favorite persons are black. I believe Mookie when he says he wishes he was black. Mookie: ""Who's your favorite athlete?"" Pino: ""Magic Johnson."" Mookie: ""Favorite actor?"" Pino: ""Eddie Murphy."" Mookie: ""Your hair is kinkier than mine. And you know what they say about dark Italians. You wish you were black."" Coincidence. I think not. I think people who love/hate blacks wish they were black themselves. Especially if everyone they admire is black, and set their hair to look black themselves. Vito is the decent, younger son. His face is hideous but he's a pretty nice guy. He's friends with Mookie and everything. Sal---he's very mysterious. I mean, it appears that he's decent since he considers Mookie his son, but then the way he talks to Buggin' Out (Mookie's friend) is inacceptable. Buggin' Out: ""Why don't you put some brothas up on that wall!"" Says he when he sees there are only Italians up on Sal's ""Wall of Fame"" Sal: ""Hey, when you have your own store, you can put up all the brothers, sisters, neices, and nephews you want. But this is my store.""

As the movie goes on, people become less tolerant. Sal seems to get more bitter towards black men by the day, but when Mookie sister Jade, a black woman, comes in the store. He goes blank as if he's been flashed by a ray. He falls for her like a sack of bricks, and Mookie dosen't like it one bit. ""Stay away from my sister,"" he says. Story lines good: Actings good: Except for Spike Lee, for he, like in Jungle Fever, says words out of his mouth but he has no expression. Everyone else did great. Especially John Turturo and Danny Aielo. Go see it. Buy it at a store or look for in in the Bravo or FX channel. That's what I did. And I can't wait to see it again!",,7 August 2001
My favourite movie of all time...,"Spike Lee is my favourite director, and it depends on which of his old or new movies I like.

Maybe he has an irregular career, but Spike counts on masterpieces, in his youth and cinematographic maturity.

It was in 1989 when he brought us one of the most relevant movies ever. Do the Right Thing is a film which dyed itself with honor since its conception.

In America, critics and experts feared its release, even before it. Because of its controversy.

But that could not avoid a deserved ton of awards and an unforgettable legacy. It is preserved in the National Film Registry since 1999.

And we should not be.surprised. Maybe we will never watch another coexistence story like this, an ethnic clash disguised under a mask of adult comedy.

Visually, this Joint is beautiful. You can feel the warmest summer day, the sweat and the tension in the air of Bedford-Stuyvesant, where every character in the film lives.

Do the Right Thing touches plenty of topics in human nature, like sex, racism, friendship and more. This includes the title.

Its soundtrack also fits with the movie in an urban harmony.

If you were looking for an iconic and historic movie, do not waste the chance and watch Do the Right Thing. The movie that will always be in the most special place of my inner cinema lover.",10.0,16 July 2021
Anyone who rates this less than a 9 is a clueless yt,"This movie is one of the greatest joints ever created. I see a lot of heauxs mad on their bad reviews. Likely some of my fellow people, but only who use the hard R in private.

I saw someone say the movie is ""hateful"". Lol. Only a clueless yt person would say that stuff. This is a direct result OF the hate minorities have received in this country throughout its history. It's a commentary on how other minorities are pitted against each other while the yt man benefits.

If you don't see that in this, you've either lost the plot or never picked up on in the first place.

Guaranteed that the bad reviewers absolutely *loved* tripe like Titanic or Armageddon.",10.0,24 July 2023
Great - but wrong.,Magnificent film. Prescient in so many ways. But Spike Lee is wrong in so many ways on the issues (not the least of which is regarding Tawana). One of the best films ever. But so too is Gone with the Wind.,9.0,18 June 2020
A movie everybody should watch,"Very impressive directing, movie really takes you over",10.0,24 June 2020
Do the Right Thing,"Artful and smart but eventually abrasive, brutal, but uproarious comedy surrounding race relations in NYC and the two different mindsets employed by MLK and Malcom X but it's not preachy.",9.0,12 April 2019
Lee's film falls short of its excellent premise,"When I read Spike Lee's journals, I expected to be really impressed with the final product. I was extremely disappointed with the film. First, though, there were certain elements of the film that I thought were good: 1. I thought that Danny Aiello's performance stood out as extremely good. Of all the characters, he was the one with the most depth, I thought. 2. Spike Lee has a very strong aesthetic sense. Visually, the film was very interesting a lot of the time. I do think that he could have done more with the motif of extreme heat throughout the middle third of the movie.

3. Lee represents ambiguity well in places--for instance, he shows that despite certain racist elements ingrained in him, Sal/Aiello is not a bad person. Of course, I think he romanticizes the character of Sal in parts.

4. The scenes that did not have any dialogue (I'm especially referring to the riot scene) were very powerful. Lee builds suspense and interest extremely effectively.

Which brings me to my list of complaints.... 1. I thought Spike Lee's performance was atrocious, often comically bad. I think he should have skipped trying to be a complete auteur for the film and let someone more qualified play his role. The final scene with Danny Aiello is one of the best-written scenes in the movie, but Lee nearly ruins it with a wooden reading of his lines. 2. Much of the dialogue was extremely awkwardly constructed. Reading his journals, I had extremely high hopes for intelligent screenwriting, but I was really disappointed. I understand that Lee was trying to make many points about violence and about race, but I thought that he resorted to ""speechifying"" rather than assuming very much intelligence from his audience. By tacking on speeches about race relations, he missed a good opportunity to incorporate them more effectively into conversations.

3. Having Spike Lee's character of Mookie throw the trash can through the window of the pizzeria (by the way, did anyone else find it odd that they spelled it ""pizzaria""?) was a mistake, I think. It would have been far more plausible and more satisfying if someone else had commenced the riot. Spike Lee could have gotten his point across much more effectively had his character simply not done anything. 4. The film seems extremely dated, to the point where something that may have been comical in 1988 is simply not funny, whereas other elements that were not intended to be humorous have become amusing. This isn't something that I can necessarily fault Lee for, but it was rather distracting as I was watching it. 5. I just don't think that the writing is intelligent enough to do justice to Spike Lee's very important ideas about the topics addressed in Do the Right Thing.

What worries me, however, is that my problems with this film stem from the fact that I, as a white male, might never fully understand Spike Lee's perspective on racial issues. I want to be as objective as possible in my assessment of the film, but can I escape my own cultural and racial pigeonhole?",5.0,9 June 1999
Not a boring moment,"This movie kept me at the edge of my seat through the whole thing. It captured the attention with the coloring, fast pace, action, and humor. The relations between the characters was my favorite part, with great development and interactions, whether light-hearted or negative. After attending an inner-city school there were certain aspects I found particularly funny, though I might have been the only one, or at least the only one willing to laugh relative to those around me. It sparked a great debate after, and when I made my first point I found my voice was shaky and betrayed how much the movie had gotten to me. I am not sure whether Mookie did the right thing, but each person would have a different view of this, particularly dependent on their background and experiences. Though it was rather difficult to watch at the end, I would definitely recommend this to anyone who wants an amusing, high-intensity film.",,10 May 2013
Do the Right Thing,,10.0,18 June 2023
An absolutely breathtaking film,"I've seen a good number of Spike Lee films but this is by far my favorite. This film takes in Brooklyn, home to lots of different ethnicities which creates diverse neighborhood or some racial tension. This film does an amazing job covering such tensions as it accurately shows how some little thing can create a big incident. Danny Aiello performance in this film was breathtaking as he played his role to perfection.",9.0,5 May 2021
A movie that stuck in my soul,,9.0,4 August 2023
spectacular film on bedstuy NY life in 89,"The movie do the right thing was directed by Spike Lee and produced in 1989. The film takes place in the BedStuy neighborhood in New York. The message was about poverty, race, and culture. The Bedstuy neighborhood had parallels to the Jewish Ghetto except the Bedstuy neighborhood was more diverse. The movie starts with introducing what life is like in the neighborhood. The main characters are Sal (Danny Aiello), ""Da Mayor"" (Ossie Davis), ""Buggin Out"" (Giancarlo Esposito), ""Mookie"" (Spike Lee), Radio Raheem (Bill Nunn), and Pino (John Turturro). Sal owns the neighborhood pizza shop called Sal's famous pizza. Mookie works as the delivery person. Pino is Sal's son who also works at the pizza shop. The cast is racially diverse and highlights interactions built on race. Racial slurs are thrown around, some which I hadn't heard before. A theme in the film is the heat because it was the hottest day of the year. The movie gets its name from a point in the middle when Da Mayor tells a passerby to always do the right thing. The inciting incident to the climax was a strike on Sal's Famous Pizza and the climax was a violent outburst between Sal and folks in the neighborhood. This resulted in the death of Radio Raheem. The social justice issue here is police brutality. Police brutality is actually a multi-racial issue and it's important to note not all perpetrators are white. However, the majority of victims of police brutality are black and it is a tragedy. Compared to The Great Dictator movie this one shared a theme of social justice. Panning, full shot, and close up were used.",8.0,7 February 2020
Love & Hate Culminated into One Knockout Flick,"Spike Lee is one of the most beloved albeit controversial filmmakers of our time, with plenty of films under his belt that have either won over or divided audiences. His best work is known for analyzing racial tensions, contemporary media, urban crime and political dilemmas, all by peeling away the layers of life to reveal the brutal hypocrisies it offers. Arguably the film that really punched critics and audiences in the gut with such raw themes was Do the Right Thing, as it became one of if not the most critically acclaimed film of 1989, and for good reason.

Set on a hot summer day, the story focuses on the simmering racial tension in a Brooklyn neighborhood amongst the African Americans and Italian Americans, which soon turns to tragedy and rampage. With this in mind, the major cultural differences are prevalent throughout, but at no point does the film scrutinize one side only. While there are multiple characters around, each one shares their own perspective on life and race, thus rendering a connection to the viewers. The iconic words ""love"" and ""hate"" really do summarize the film well, as it's not good to use violence to solve your problems, yet it's also not immoral to use it in self defense. Admittedly, some of the archs do drag on, but it's no more to add in to the climax of the film, which to this day still has us debating on whether or not the main character Mookie did the right thing.

In addition to how full of personality the characters are, the dialogue is also packed to the brim with distinct street talk. Whether it'd be Mookie's interactions with his ""brothers"" or Sal and his boys, or the daily residents just talking to one another, the verbal language practically invents how the characters think, making them very relatable as well. From a visual standpoint, the style adds in to the film's vibrant nature. The decision to shoot with mostly deep reds really makes one feel the heat that the Brooklyn residents were experiencing. The usage of viewpoints and angles are done to great effect, as they add in to the tumultuous and unpredictable tone displayed throughout the feature. For one of his first features, Lee really knew how to be playful with the equipment needed.

So needless to say, while it may be hard to stomach at times, Do the Right Thing succeeds in displaying the honest nature of urban culture in Lee's hometown of Brooklyn. You can say the film is really just an incitement, but dig a little deeper and you'll realize that it does not condone violence as much as it speaks on the circumstances of what could lead to violence. Alongside having hilarious character banter and an exuberant film-making stance, the film manages to be powerful without inducing a moral ground. The people in this film are not perfect at all, but their feelings and emotions are what make them resonate with us as individuals. Remember, if you simply can't understand the way someone feels, what makes your outlook any better?",8.0,19 January 2019
Everyone Wants to Do the Right Thing,"In 1989, Spike Lee decided to release a joint that was a controversy causin', argument startin', extended fourth wall breakin' rant havin', public violence incitin', social commentary makin', moral question philosophizin', poetically stylized cultural snapshot of a story about a hot as hell day in a Brooklyn neighbourhood. Do the Right Thing follows a day in the life of pizza delivery man Mookie, played by writer, director, producer, and star Spike Lee, and all the neighbourhood regulars as the summer heat adds pressure to their already tense dynamics. Each of the characters are somewhat odd and unique, while still seeming familiar and relatable. Ossie Davis plays the loveable drunk, Da Mayor, who maintains a wholesome attitude and has several endearing moments of virtue throughout the film, serving as the strong, if not weathered, heart of the community. His attempts at winning the affection of Mother Sister (Ruby Dee) are persistent, but never cross the line of being inappropriate. His selfless and admittedly foolish reflex to do the right thing, such as when he saves a boy from being hit by a vehicle, gains him respect from Mother Sister and most of the community, with the exception of a young man who berates him as the cause of his own problems even as Da Mayor pleas that the man doesn't know what he's been through. Although certainly cruel, even this random angry young man believes that he is doing the right thing by explaining his views of homelessness and its causes. Whether morally commendable or not, all of the characters in Do the Right Thing are trying to do exactly that, even in acts of violence. Radio Raheem (Bill Nunn) blasts Public Enemy wherever he goes, aggressively standing his ground against the power, while Buggin' Out (Giancarlo Esposito) more vocally fights for the black man's place on the wall of fame in his community. Is pizza shop-owner Sal (Danny Aiello) not also entitled to stand behind his own decisions about his business? When everyone feels compelled to take action against injustice, friction is inevitable, violence and destruction are often the result. There is a surreal moment halfway through the film when the characters directly address the camera with rants filled with racial slurs. This is one of the ways Spike Lee uses artistic techniques to tell the truth. It is in these moments of poetic realism that the film is able to evoke the climate of the culture at that time and highlight societal sentiment in an honest way. The two quotes at the end of the film from leaders Martin Luther King Jr. and Malcom X, who Smiley (Roger Guenveur Smith) has been parading photos of throughout the movie, articulate the paradox of violence and the struggle to do the right thing in the face of oppression. And as Samuel L. Jackson's Mister Señor Love Daddy would say, ""That's the double truth, Ruth.""",9.0,8 November 2019
Spike Lee and Do the Right Thing,"I just recently viewed Do The Rigth Thing, which is by Spike Lee. I thought that it was a mediocre motion picture. I felt that it was very controversial and saddening as to how the different races were treated in the film. The beginning of the film starts with a girl dancing for a long period of time. The dancing and music were very interesting, but I didn't understand the significance of it in regards to the film. The characters did a very good job with their parts and I thought that the music was also good. It was also different, but not in a negative way, how the film was based on only one day. Spike Lee was able to make a 120 minute movie out of one day's activities. The ending of the movie was saddening and left me with a bad feeling. I thought that this movie was good, but I don't think I would go out of my way to see it again.",5.0,31 March 2005
Perhaps controversial but great either way,"Do the Right Thing was an excellent movie. It was awesome, until the end, then it got frustrating. Why can't we all just get along? But it sends a good message and makes some good points. The actors were excellent and the plot and storyline were great.

Spike Lee did a great job filming the movie on one block in the city and creating the feel of a boiling hot summer day. Using orange paint to create the mise-en-scene of the stifling hot day work. The actors looked sweaty and uncomfortable in the heat and the whole set made the feeling of stifling and hot. The film was fast paced and had good editing. It ran smoothly and didn't really have a slow moment. Lee didn't go into too much detail nor did he give too much detail to give a bias. The temporal relationship was good and covered one day which was really cool how he covered one day in the movie. The music was great, especially Radio Rahim's boom box. Every time Rahim was on screen his boom box played Fight the Power which was perfect for the whole message of the movie. Another notable piece of camera-work was the closeup Lee used on his characters, especially with Radio Rahim and Sal in the end before the big riot.

This movie was excellent, great camera-work with a great controversial message that really put Lee under the microscope and scrutiny.",,16 December 2011
"""Are we gonna live together? Together are we gonna live?""",,10.0,12 June 2023
Fantastic Commentary,"""Do the Right Thing"" is a striking example of juxtaposition. Set on a colorful street with an almost silly premise, this film takes on very sobering themes. Many things in this film make it feel almost cartoonish, such as dramatic camera angles and zooms, but not in a bad way. The plot of this movie revolves around racism and bigotry within the inner-city, something that isn't often glamorized or put on the big screen.

""Do the Right Thing"" is a must watch for anyone wishing to better understand race relations. It reflects very real issues still present today, and the 80's setting still holds up.",9.0,11 May 2021
Spike Lee really did amazing job on this movie!,Do the Right Thing really surprised me by Spike Lee himself. The movie was released in 1989. Took place in the summer. Spike Lee plays the character dude Mookie. Works at Sal's delivers pizzas. Then there's Sal and his sons also Radio Raheem played by Bill Nunn. Blasts his boombox with the Fight the power song so funny. Bugging out He stole the movie trying to Get Sal and put Black people on his wall. Smiley special needs He was funny too. Also we see Martin Lawrence and the funny neighborhood group. Sal destroys Radio Raheem's boombox and towards the end of the movie all Hell breaks loose and Spike Lee throws trash can at Sal's window and burns down his place.. Soo crazy towards the end! And the Korean man said We Same. This movie is a masterpiece by Spike Lee. Must Watch!,10.0,18 April 2024
One truly great film!!,"This is truly one of the great character driven films ever produced! Love this film or not, there are more than enough cool & compelling characters in every scene for any viewer!! This movie will trigger a whole lot of different emotions. No way you can watch this movie from beginning to the end and not feel something!!",10.0,22 May 2019
I loved it then and still do today.,"Straight from the opening theme of 'Fight the Power' by rap stars Public Enemy, you just know this is going to be a thrilling and dynamic drama from (the then) up and coming Spike Lee. The soundtrack in fact is it's main strength and at times carries the action but the story also contains some really well thought out characters (with maybe some over the top racial views). The whole premise of the film is to deal directly head on, with the racial hatred that boils under the surface. Sometimes there is love to. It all occurs on the hottest day in Brooklyn and the ending is somewhat a release to the over growing N.Y tension.",9.0,14 April 2020
