review_title,review_body,rating,review_date
"Great Film, but Not Without its Flaws","This film tackles hard topics with a confidence almost unseen in cinematic history prior, headed by one of cinema's most talented directors, Spike Lee. Spike tells the story of a particularly hot dog day tearing a neighborhood apart and makes a film that, while surely a product of its time, is still very relevant today. My one criticism is that it doesn't quite say anything about the animosity, but rather takes an optic on it, not an inherent flaw, but not my type of film, personally. A must watch, but one I certainly don't likely see myself watching it again.",7.0,18 November 2021
Lee's Style is not for everyone but this film does many things right,"Spike Lee's Do The Right Thing(1989) announced the arrival of a new and provocative filmmaker to the American Cinema landscape. Spike Lee knew the ""rules"" of filmmaking but decided to break many of them. The avant garde style of Do The Right Thing and the occasional breaking of the 4th wall reveal's Lee's willingness to take chances in filmmaking and truly engage the audience in the film's message of the powder-keg that is race relations in the inner city. The performances of the film were highlighted by Ossie Davis' fabulous portrayal of Da Mayor in a role that provided laughs and heartbreak. There were no weak links in a cast that failed to capture true verisimilitude but captured the complex relationships and emotions of a neighborhood on the edge.",8.0,13 May 2011
A comedy with a very serious message,"Spike Lee's Do the Right Thing (1989), though now over 20 years old is still as completely socially relevant then as it is today. The movie unflinchingly depicts our society and its many ""racial societal divisions"", which when it was released made many people angry and uncomfortable (it still does today). Probably because there was some truth to it... The film itself has a range of excellent and developed characters, each with a distinct persona. What is also notable about this film is how excellently Lee builds the day up. The movie begins as a comedy, lulling the audience, and then when the movie peaks literal hell breaks loose, and the movie is suddenly incredibly serious. This makes Do the Right Thing accessible because it is able to reach a wider audience by combining both elements.",8.0,13 May 2011
Hypocritical Garbage,"Spike Lee's pathetic attempt to glorify hypocrasy and laziness and turn it into an issue of racism by ""the man"". In many ways this movie exposes the truth in it's hypocrasy. Lee didn't do his race any favors by making this waste of time.",1.0,4 July 2019
Avoids turning into a walking cliché or a heavy-handed lecture,"Racial relations in films leave much room for sugarcoating and biased views of one or more people on the cast and crew, but thankfully, Spike Lee is too smart to take sides or choose whose battle to support. In Do the Right Thing, he shows how racial relations have hurt one specific street block in Brooklyn. The result soars past any expectations one has going into it.

The film plays like an anthology, featuring people that resemble real people, and who pack in realistic flaws. It takes place on a brutally hot day in the neighborhood, with the temperature in the late nineties to early hundreds. The film's center is a pizzeria on the street, called Sal's Famous, which is run by an Italian father and his two sons. The father is Sal Frangione (Aiello) who has been on the block for over twenty years, and his sons Pino (Turturro) who refers to coming to work like ""Planet of the Apes,"" and Vito (Edson) who is accepting of the blacks.

They're the only white people we see throughout the whole film and yet, despite some of their comments, we can sympathize with them in a way. All they want to do is run a business, but odd complications plague their day. The only black character employed at the pizzeria is slacker Mookie (played by Spike Lee himself). Mookie is a gentle and sweet kid, but seems to develop a distracting fondness for anything but his work.

Other people around down are simple, frequently drunk ""Da Mayor"" (Davis), Mother Sister (Dee), who observes the neighborhood through her window, Radio Raheem (Nunn), who blasts his music at deafening level on his boombox, which annoys many, Buggin' Out (Esposito), a geeky man who wants to see some black people on the wall of Sal's Famous, and Sonny (Park), a Korean grocery store owner across the street from Sal.

Not a lot of films can perfect the idea of ""all characters, no plot,"" but Do the Right Thing is effortlessly convincing. The film also excels in being extremely original and stylistic in the sense that the heat from the day itself seems to be creeping out on screen. All the characters are soaked in sweat and the cinematography is so bright and loaded with primary colors that it comes off as infectious and unique. Even the air looks to be seamy and murky. Every detail is included, and nothing is overlooked.

Finally, there's the climax, one of the best, most involved I have yet to see. It's unexpected, well-choreographed, and never misses a beat. It doesn't seem cartoony, as much as it seems realistic and well done. I wish I could go into greater detail, but it needs to be seen to be believed. Also, one of the characters does an act you wouldn't think that insights one of the major plot points. I think it's safe to say, he didn't do the right thing.

Do the Right Thing isn't only provocative, but it avoids clichés and doesn't give us the same ""racism is bad"" lecture. It's too original and intelligent for that. Lee has introduced us to likable characters that we continue to adore as the film goes on, and despite the heavy climax, we still at least respect. You're left contemplating what the right thing is/was and how would you go about doing it.

Starring: Danny Aiello, Ossie Davis, Spike Lee, Giancarlo Esposito, John Turturro, Ruby Dee, Steve Park, Bill Nunn, Richard Edson, Rosie Perez, Martin Lawrence, and Samuel L. Jackson. Directed by: Spike Lee.",10.0,5 March 2012
"An Excellent,Powerful And Unforgettable Masterpiece From Spike Lee And One Of The Greatest Films Ever Made.","Do The Right Thing is an excellent,powerful and unforgettable masterpiece of cinema and one of the greatest films ever made that mixes amazing direction,a great cast,a fantastic script,an outstanding score and soundtrack and beautiful cinematography and is filmmaking and Spike Lee at their best.

Set in the neighborhood section of Bedford-Stuyvesant in Brooklyn,New York,Do The Right Thing tells the story of a local neighborhood and people that have to deal with racial tensions and hate on the hottest day of the Summer that explodes in violence and leads to tragedy,mayhem and chaos.

Released in the Summer of 1989,Do The Right Thing is the brilliant and powerful Masterpiece that introduced the world to director Spike Lee. Although Lee had made a splash with his first two great films the Romantic Comedy-Drama She's Gotta Have It and the funny College Comedy-Drama-Musical School Daze,Do The Right Thing in my opinion was his first real breakthrough and even though Spike Lee has made many great and truly wonderful films since none of his other films(with the exception of Lee's other Masterpiece Malcolm X) have left an amazing and powerful impression on viewers like Do The Right Thing had. Right from the opening credits Do The Right Thing pulls you into an amazing unforgettable cinematic experience that keeps you glued to the screen with great intensity and fiery. It's a movie that is very realistic and stylish,funny and tragic,thoughtful and observant,raw and in your face as well as movie that grabs you by the throat and never lets go until the very end. Also Do The Right Thing maybe one of the best and greatest if not the best and greatest film about race and racism in America and with DTRT Spike Lee gives viewers and examination of Racism why most human beings are Racist and Lee doesn't sugarcoat anything and just approaches the Racism with realism and no race or ethnicity in the film Blacks,Whites,Hispanics and Asians goes unscathed. Lee has talked about race in most of his other films and in his other films they were very thought-provoking but DTRT is his most powerful film about race. The talks of Race and Racism is powerful and frank and will leave an great impression on viewers because the themes of racism is timeless. Each of the main characters in the film are real and are very complex and multidimensional and aren't stereotypes but the kind characters that we see in real life and just like in real life there are flesh and true life characters in the film that are likable and unlikable but stay with you after the film is over. What I also love about the film is the fact that DTRT takes place over the course of one day and hot weather and temperature. I love films that take place in one day or in 24 hours and DTRT gives viewers a day in the life in a Brooklyn,New York section neighborhood showing the characters doing regular everyday things but it is slightly distorted with tension in the air and the Hot weather adds to the tension. The 100 plus degree Weather is an accurate representation of not only Heat but the tension among the film's main characters that is boiling and ready to explode like a bomb and it is not the sweat or the heat but with violence and harsh language and Spike Lee puts the high level tension to the forefront and brings it out and never lets up. The beautiful cinematography by Ernest Dickerson is amazing and stylish with Ernest Dickerson making the hot sunlight and heat look great to look at with close ups and weird,tilted angles with amazing visuals making the different colors and styles come off the screen. The screenplay by Spike Lee is very masterful and well-written with Lee giving the characters memorable dialog that is harsh and true to life and each of the main characters come to life thanks to Lee's great uncompromising script. The ending or final 30 minutes of the film is one of the greatest and most unforgettable endings in film history and is an ending that greatly doesn't answer any questions and will cause for a lot of debates with no clear or easy conclusions with Lee letting the viewers make up their own minds. An amazing and powerful ending.

The whole cast is amazing. Danny Aiello is excellent as Sal,the local pizzeria owner. Ossie Davis is brilliant as Da Mayor,a drunk with words of wisdom. Ruby Dee is fantastic as Mother Sister,an old woman who watches the entire neighborhood and has great scenes with Davis. John Turturro and Richard Edsen are amazing as Sal's sons Pino,Sal's oldest son who's racist against Blacks and Vito,Sal's youngest who likes Blacks. Giancarlo Esposito is outstanding and over the top as Buggin' Out,a guy protesting Sal's. Spike Lee is great as Mookie,Sal's Pizza delivery guy Bill Nunn is wonderful and iconic as Radio Raheem,a young man who loves his Radio. Paul Benjamin(ML),Franie Faison(Coconut Sid),Robin Harris(Sweet Dick Willie),Rosie Perez(Tina),Joie Lee(Jade),Samuel L. Jackson(Mr. Senor Love Daddy),Miguel Sandoval(Officer Ponte),Rick Aiello(Officer Long),Roger Guenveur Smith(Smiley),Steve White(Ahmad),Martin Lawerence(Cee)Leonard Thomas(Punchy)Christa Rivers(Ella),Steve Park(Sonny),Lois Ramos(Stevie),Frank Vincent(Charlie)and John Savage(Clifton)give good performances as well.

The direction by Spike Lee is brilliant and stylish,with Lee always moving the camera and giving the film a beautiful visual style with tilted angles and close-ups. Great direction,Lee.

The score by Bill Lee is excellent,powerful,sad and memorable and adds to the film's tone. A wonderful score by Bill Lee. The film has a great soundtrack with songs by Public Enemy(the classic Do The Right Thing Theme Song Fight The Power),Al Jarreau(Never Explain Love),Perri(Feel So Good),Ruben Blades(Tu y Yo),Steel Pulse(Can't Stand It),Teddy Riley Featuring Guy(My Fantasy)and more. Great soundtrack.

In final word,if you love Spike Lee,Dramas,or films in general,I highly suggest you see Do The Right Thing,an excellent,brilliant,flawless and unforgettable masterpiece of cinema that will stay with you after you watch it and belongs in every film lovers collection. Highly Recommended. 10/10.",10.0,2 August 2013
Powerful and affecting,"It's easy to see how it was assumed that the film would incite certain audiences to riot when it first came out in 1989. Spike Lee's feature is certainly a balls-to-the-wall, no holds barred sort of affair that sheds a lot of light on the community complexities in the urban environment, particularly in a cultural stew as diverse as Brooklyn.

Most interesting is how Lee uses a variety of cinema techniques to enhance the viewing experience in terms of exploring this neighborhood through the point of view of the characters and audience. The use of a hand held camera style is implemented periodically to break the fourth wall and demonstrate the variety of differences and prejudices that simmer behind the cultural and ethnic interactions of the neighborhood residents. It is through these devices that the film is able to weave an analysis of the relationship, that frequently conflicts, between love and hate.

It is here where the motivations of the characters come into play, and the true artistry of 'Do the Right Thing' shines. All of the characters are well rounded human beings, each with their respective strengths, and failings as individuals, representatives of their ethnic backgrounds. Their personal prejudices and pride (of which they all share a part of) resulting from their working class struggles often lead them into amusingly horrific conflict between the characters, and much of the tension is derived from these moments. Above all this, some characters are able to offer introspective analysis into the reasons for their destitution, whether it is because of their social standing or simply a lack of personal endeavor. It is up for the viewer to draw their own conclusions from the humanity that resides there, and the mistakes that are made.

But it is not just the multitude of colourful characters that bring this film to life, but the production design and cinematography as well. Colours are imbued with reds, oranges, yellows, and loud hues to portray the intense heat of this particular Brooklyn day. The racial tensions that hover over them only add to the weight on everyone's shoulders, and before we know it the film is spiraling into its riveting climax.

This is a film that will certainly leave you thinking, and while the unnecessary exposition at the end may leave one feeling as though Spike Lee may have undone much of the complexities explored upon earlier, ""Do the Right Thing"" is still a marvelously affecting experience that is truly a portrait of the cultural experience in an ever more closely connected world.",8.0,19 May 2012
Did Mookie Do the Right Thing....?,,10.0,17 December 2010
Almost nobody's right and almost everybody's wrong here:,"Do the Right Thing, which is set in Brooklyn's Bedford-Stuyvesant neighborhood on a hot, sultry summer's day, in the midst of a heat wave, is about a bunch of people of different racial and ethnic groups who, while at the same time living in relative harmony with each other, the omnipresent racial and ethnic tensions are always lurking and bubbling just beneath the surface, ready to erupt at any opportune (or inopportune) moment.

Do The Right Thing shows that when people of different racial and ethnic groups, none of who have very much, are thrown together by chance, these kind of racial and ethnic hostilities take root and proliferate very, very easily. Moreover, this film points out a very concise message about the consequences of racial and ethnic hatred and violence; There are no winners, only losers.",8.0,26 April 2014
Pass the Popcorn review,"Do the Right Thing, directed by the somewhat controversial Spike Lee, is a somewhat controversial movie dealing with hard topics like racism, prejudice and violence. Interestingly enough, it's also the movie that Barack Obama and Michelle Obama saw on their first date.

The movie is set during an extremely hot day in Brooklyn, New York. It revolves around a group of characters leaving there. Some of the most prominent characters in the movie are Mookie (Spike Lee) who works at Sal's pizzeria, Sal himself (Danny Aiello), Sal's sons Vito (Richard Edson) and Pino (John Turturro), and an old drunk bump called Da Mayor (Ossie Davis). It's hard to find the main narrative focus since the majority of the movie consists of characters just interacting. But the central topic of Do the Right Thing is prejudice and violence.

It's hard to stay neutral when you try to discuss what is the role of violence when trying to achieve racial equality. However, Spike Lee manages to stay neutral – during the whole movie he never says whether he considers violence to be justified or not. He just presents his characters like they really are, he presents them as real people. No matter if his characters are black or white, he presents them all as grey. This lack of definitive answer might annoy some people, but I had no problem with it. I liked how Spike Lee left the interpretation to the audience.

Apart from being a movie that could easily find its place in some philosophical/sociological/psychological debate, Do the Right Thing is also masterful on the technical level. Spike Lee amazingly uses awkward close-ups and camera angles to further portray the tension between the characters. Furthermore, the song 'Fight the Power' by Public Enemy is effectively used throughout the whole movie as a fitting soundtrack to the Brooklyn setting. The actors also do a pretty good job. John Turturro is great as the racist Italian Pino, Spike Lee is plausible and believable as the easy-going Mookie and Ossie Davis does a memorable portrayal of the drunk Mayor. Samuel L. Jackson's role as the local radio DJ is almost a cameo but greatly done. Do the Right Thing is truly good on every level, and its thematics are strong, shocking and important even today. I strongly suggest watching this Spike Lee joint.

Rating: 8/10 Read more at http://passpopcorn.wordpress.com/",8.0,7 August 2013
The Sacred Cow Spike Lee,"The mind boggles - the AFI called this hateful piece of crap one of the top 100 films of all time. Some of the four-star reviews are absolutely hilarious! Stereotype-free was one thing I read. Right. We've got Ossie Davis as a drunk, and a shiftless pizza delivery guy for openers. And remember folks, starting a riot is ALWAYS doing the right thing. What did white people do to this guy to make him hate them so much?",1.0,24 June 2020
"A day in the life story about a racially diverse neighborhood in Bedford Stuyvesant, Brooklyn","Spike Lee's Do The Right Thing, is the most masterfully crafted movie that I have ever seen. I've watched this movie several times and every time I re-watch it I am stimulated and blown away. The characters in this movie are outstanding, there are no flat characters and by the end of the movie you feel as if you have grown up with them. The cinematography in this movie is out of this world. It is almost unbelievable that it came out in 1989, some techniques are so ahead of there time they look futuristic even by todays movie making standards, 9 out of every ten shots in this movie are works of art. Not only is Do The Right Thing artistically brilliant in almost every aspect it is also thoroughly thought provoking. You could view this movie then come up with a hundred discussion questions and discuss them for hours of scintillating conversation. If any one ever tells me that Spike Lee is a hack I tell them to watch this movie and they come back agreeing that he is a genius. I gave this movie a nine out of ten because I have yet to see the perfect movie but this one is about as close to perfect as you can get. 7.7 thats a travesty! This is one of those rare movies that can change someones outlook on life.",9.0,7 March 2007
Beautifully constructed social commentary,,10.0,25 July 2016
"""Always do the right thing.""","This was an interesting film. I don't know that I have a particular opinion just yet, especially regarding the controversy that surrounds it. There seems to be a lot of debate over which group of people this film portrays in a worse and/or better light, and what the final meaning people are supposed to get from it is. I think the intention was to get people talking about it in the first place. From there, I don't think any actual conclusions were made, it was left mostly ambiguous. There is no 'correct' answer. This leaves the audience accountable for their interpretations. Spike Lee presents an evocative piece, but it doesn't necessarily lean one way or the other. He tells the story and any leaves the audience to their own thoughts. You could probably tell a lot about a person, just based on their interpretation.

Aside from all this, I really enjoyed the cinematography. It was incredibly effective in conveying the heat, and the painted on color was just crazy! But great all the same. I loved the slightly overt filming style too, the camera feels like another person, and its perspective is somewhat sentient in nature.",8.0,8 May 2014
Do the right thing?,"The first thing worth noting about Spike Lee's ""Do the Right Thing"" is that the film revolves entirely around a message it presents. It's less of a movie you watch and more of something you experience.

""Do the Right Thing"" centers around a pizza delivery boy in a (nearly) all black neighborhood during the hottest day in Brooklyn history and the choice he makes in the last section of the movie. Building up to the end, the neighborhood is filled with unique characters with distinct personalities and how they live their everyday lives. ""Do the Right Thing"" is uplifting, practically a comedy, during the first half of it. Ultimately the racial tensions escalates and the film has a dramatic shift in tone.

Without giving anything away, Spike Lee presents a bitterly harsh reminder of the racial tensions of the time. It leaves the audience wondering if the right thing was done, or what the right thing to do even was. ""Do the Right Thing"" is a great film with great cultural significance and is certainly worth watching.",9.0,8 May 2014
Almost a masterpiece,"I decided to watch this movie after an English teacher of mine touted it as the greatest film ever made. I was somewhat skeptical upon hearing this, but that night I rented and watched it. Do the Right Thing is set in a primarily African-American area of New York City during the hottest day of the year, and is centered around an Italian-owned pizzeria. The first thing I noticed about the film was that it was absolutely brimming with the essence of the late '80s. The colors were bright, the music was relatively corny, and the costumes were strangely elaborate. I'm not a huge fan of the late '80s culture, but somehow the film was able to combine these features into a very watchable form. I was able to watch the entire movie without interruption (which is a pretty remarkable feat for me). As the story unfolded, I found myself becoming more and more frustrated. I believe that this frustration may have been intended by Spike Lee, but it somewhat diminished my enjoyment overall. Everyone in the film was so angry all the time, with the exception of Danny Aiello's character for the most part. I found myself repeatedly at my boiling point of rage when I saw how much ignorance was portrayed in the film. It seemed that much of the movie was sympathetic towards racism, as many of the situations that would rouse sympathy for African Americans were caused by their own ignorant actions. Most notably, the actions of Giancarlo Esposito's character struck me as extremely inflammatory. This film taught me one important lesson, however: Ignorance leads only to more ignorance. I was glad when, at the end, the text shown alluded to that idea. Before then, I was somewhat disappointed with the film, really. I felt like it was a movie that merely hated the white man, which wouldn't really appeal to a middle-class white kid like myself. Overall, though, I thought that this movie was pretty great, and for all my gripes, the story came together very well and exceeded the sum of its parts. 8/10",8.0,15 February 2011
Do the right thing review,"Do the Right Thing directed by Spike Lee was a good movie overall but one that really made me mad. This movie was very powerful and gave a look at the racism and tension that was going on in Brooklyn, Ny. It had tension between the piazza shop, the African Americans, and the Whites. It also fit perfectly with what is going on today with the police killing unarmed people. It really made me mad at the end because of all the rioting and destruction that the people did to the piazza place. The cops choked the man to death so they took it out on the piazza shop. It made no sense to me. I also didn't get why Mookie started the riot by throwing the trash can through the glass. I just didn't get it because he seemed like a really good guy. The movie technicality wise was great. The color they used was like a red orange type and it was great. They also did it perfectly showing how hot it was and what the people were going through. You could see the sweat and the colors just made it look very hot out there.",10.0,5 May 2015
