review_title,review_body,rating,review_date
"Official Review of an Unofficial Family - Winterim, The Foreign Film Festival","This movie tells the story of a group of japanese people who represent a ""family"" despite having no relationship to each other. We think it's a good movie, although it can get pretty confusing, very quickly. This is because of the amount of people that don't go by their real names and the fact that some characters use other character's names. (NO SPOILER) The children in the family have been taken by the father , and are used to shoplift from stores due to the family living in poverty. They find a little girl outside of her house, and take her in to save her from her own family's abuse. The film aims to define family- not by blood but by soul- and their eventual downfall. The five most important characters in this movie are Yuri, Shota, Grandma, Osamu, Kie Miyabe, and Aki Shibata. Along with the intricate familial connections that are referenced in the movie multiple times, this makes the movie a good movie with some disconcerting aspects. Ultimately, we think this movie's lesson is about seeing past prejudice. The movie introduces the characters in this film as a ""family"", you come to learn throughout the movie that this isn't exactly a traditional family, and that what bonds them all together initially is having committed something which society considers ""wrong"" (murder, thieving, kidnapping, benefits fraud, etc). But as a viewer, you have been made to care for each of these characters, despite what brought them all together. It's a movie about things not always being as they seem, and what that ultimately doesn't matter. The people at their chore, care for each other, in their own strange way. We don't think this movie is necessarily accessible to young people, but more people in their 20s or 30s.",8.0,23 March 2021
Should be a shoe-in for Oscar nominations in Best Foreign FIlm,"I watched this at Cannes and absolutely loved it. Along with COLD WAR and BURNING, this film was my favorite in competition. It deftly woven together social realist tale that breaks your heart without ever once manipulating you. That humanizes its characters without ever patronizing them. A perfect movie.",10.0,28 June 2018
SOCIAL REALISM AT ITS FINEST,,10.0,23 May 2018
Family concepts,"Great movie set in the nowhere of Tokyo with an unconventional plot and outstanding acting performances.

It seems to present us a family, which tries to supplement its scarce family income by continuous shoplifting. The simple justification for this immoral behavior is that the shop items do not yet belong to anybody. Next to this little weakness, the family ties seem to be in good shape as family members do listen to each other.

The trick of the movie is that it is constantly laying trails of doubt whether these people living together in the small dingy house surrounded by big apartment blocks are in fact a real family. Why is it so easy for most of them to accept little Yuri as a new family member? Why does Shota refuse to call Osamu his Dad? How can Hatsue tell Nobuyo that she has chosen her as her daughter?

Trains of thought start what else they may be if not a family and what brought and keeps them together. According to a statement in the movie, it is actually money, which makes the bonds. This in the end turns out to be (the unpleasant) part of the truth but no more than that.

Then, around the next corner, the movie makes you think why not to call these people a family as they apparently care for each other. Why should not they share a common shelter if it keeps them off loneliness? Has not 5-year-old Yuri chosen to stay with these people rather than with her real family where nobody seems to like her? In this way, the movie suggests that there are various concepts to a family and that the one based on common blood is not necessarily the best.

Next to this central issue, I also liked the movie because of its Japanese peculiarities. For example, all the eating is done while sitting on the floor and the noodles are sucked into the mouth in a loud and for European ears rather disgusting way. On the other hand, it is surprising to see Japanese characters that are both highly human and imperfect at the same time.",10.0,18 November 2019
Amazing,"This film skyrocketed to one of my favorite films ever. This film makes you question, deeply, what love, family, and humanity all is. It's the only film I know of that is paced as a slice-of-life film with an underlying thriller/mystery feel. Truly amazing.",,7 September 2020
Sensitive direction and a marshmallow storyline,"I will not expand here on the delicate direction and sensitive story. I guess plenty of people have been writing and singing about this but, if I may be a tad insensitive, mastering direction and having a nice storyline is not sufficent to make a great movie.

I enjoyed it, as I always enjoy the craft of highly-skilled/gifted directors, but come on, Shoplifters really plays it easy with its sugar-coated storyline. ""Subtle"" here means a recipe where you bundle 100% golden-heart characters with some potentially darker but not-so-important backstories that audience is allowed to know in the end. The emotional stress stays the same all along, aside from the little girl's situation (which stays pretty generic) there is no one you can really empathize with. Basically, gentle characters are well directed within an empty shell.

In a nushell I enjoyed the craft but kept waiting for another dimension to materialize, and in the end this movie stands light years behind references like de Sica's Bicycle Thief or Kurosawa's Donzoko.",6.0,17 March 2019
One of the best japanese movies so far,"The chemistry between actors, outstanding story telling by director, character developments, the camera works (especially showing the family watching hanabi from the upper view makes us understand the life of an outsider) and the unsaid words to each others. Perfect!! Perfect drama!",10.0,27 November 2020
Solid Effort,"Realistic performances, brass-bound comradery, and some startling, natural comedic tones makes Shoplifters a solid time at the theaters. The addition of having some of the most charismatic moments of the year sprinkled throughout, also, nearly raises it to glory. An adequately challenging ending to top off the piece, furthermore, supplemented some noticeably thought-provoking slices of commentary on the bitter truths of how the real world works.

'Tis a shame, however, that Shoplfiters kind of reflected off to me as the poor man's Florida Project, personally. There was zero to nothing explored in this movie that I hadn't already witnessed from previous filmic dramas. I may have been emotionally affixed to the characters, but there still wasn't enough idiosyncrasy or even enough engrossment in the events/segments for me to appreciate its sum. It's cinematic flair, while well-done, wasn't anything noteworthy or outreaching/boundary-pushing-of course, according to my judgement.

I know, I'm one sinister human being for not loving Shoplifters. Mwahahahahahahahaha. (Verdict: C+)",6.0,22 November 2018
What is a Family?,,10.0,7 November 2018
"""Whatever's in a store doesn't belong to anyone yet.""",,6.0,15 August 2020
Over-long Drivel Pretending To Be Profound,,2.0,28 November 2018
Heartfelt and engrossing,"I genuinely love this film. As a whole package, it sends the viewer on an emotional journey and makes you question things that you take for granted. The pacing is good and it's visually nice to look at. I loved the sets and the environments, especially the house. It told the viewer a lot about the characters in subtle ways.

Speaking of the characters, they're all wonderful. Every one of them is real and flawed and dynamic. The performances of the child actors was great, some of the best acting by young children that I've seen. The way that all of the characters interact with each other helps you care about them and piece together every part of the story. I was thoroughly invested in their lives by the midway point of the movie.

Worth a watch and a rewatch.",9.0,3 December 2020
Can't think of a better movie that wonders about the true meaning of family,"Shoplifters is the story of a family living in the outskirts of Tokyo, which is already struggling to get by everyday, and how they manage to deal with harbouring a lost child in their home.

The interesting thing is the family's actual bonds - blood or otherwise - don't become clear until very late in the movie (perhaps not even then).

The film is visually stunning. Among other things, it really makes you feel cramped in their tiny apartment and has some brilliantly taken shots - the one from the place where Shota, the older kid sleeps, is my favourite.

The film is already a masterpiece by then, but the way it quickly unfolds in its last 20-30mins is quite gripping and incredibly emotional - where all relationships are stretched and/or unearthed.

Goes straight into the list of my favourite movies, off to see others by Hirokazu Korreda!",9.0,24 October 2019
A masterpiece of storytelling with serious commentary,"This movie is exceptional in a variety of ways. Starting from storytelling, you get almost instantly absorbed and invested in the lives of the characters, with a perfect harmony between the interactions of them al, Koreeda achieves an evolution of the characters, while driving the main plot and also portraying to delightful success the daily lives of the characters. As a viewer I think it would be very difficult not to connect to the experiences of the children, and to relate deep enough so that questions of family and the meaning of it arise while not discarding the crooked lifestyle of the family.

This movie is Cinema at its finest, exceptional execution of a story while leaving the viewer with deep questions of fundamental issues like family itself, and the moral and ethical themes that arise from relevant problems such as intrafamilial violence, poverty and theft, by a retrospect that shows all their nuances, true to life.",10.0,21 March 2020
One of the best films I've seen in years!,,9.0,13 January 2019
Lost in translation,,,4 December 2019
Interesting japanese movie,"A film that can move or even impact some, is quite interesting and gives a lot to talk about.",6.0,1 June 2020
"A film rare in its deft storytelling , balance and finesse","The film has an easygoing dynamic to it but you will always find yourself drawn into the film. Although it centers around what seem to be several different tragic circumstances The mutual love the characters show for each other and the way they care for one another is touching even though they are guilty of some dubious behavior. So you might be surprised how you find the film will touch you. There is this interesting juxtaposition of societal authority and the real life consequences for the characters in the film, The State doesn't always get the nuance of people's real lives and the rules they enforce don't always make things better. This film tells a story with such subtlety and is never ambiguous and you are surprised by what you see and how you react to it. A story so lovingly told you will be moved and won't for get it. I cannot praise it enough.",9.0,4 September 2019
"I liked it, a lot at times",,6.0,12 February 2019
What a family should be.,"The thief Osamu and his son, returning from ""work"", pick up a girl in the street who seems abandoned. Although reluctant, Osamu's wife agrees to shelter the little girl for the night. Then, when she learns that Aki is mistreated by her parents, she decides to keep her. Although poor, living on small raids, they all live a happy family life. Until...

What is family? A union imposed by genetics and codified by society? Or a group of people living together united by the bonds of the heart? Who really deserves the name of parents for little Aki? Those, genetic, who hit her and neglect her or those of substitution who wrap her in love, even if they are thieves? Kore-Eda (as in ""Like father like son"" in particular) clearly leans towards the second case. A theme that the director treats with subtlety and depth, far from any easy moralism... He really is the Japanese Comencini. What also characterizes Kore-Eda is the fine way he directs his actors: under his guidance, all prove convincing, whether young, adult or old (special mention for Kirin Kiki, the grandmother) but it is the children who really get their way: this tall, thin boy, who is beginning to mature and this little flea, beaten and abandoned, who has difficulty in verbalizing, do not seem to play: they are the characters. The only problemetic things are the slow rhythm, the lack of climactic scenes and a slightly excessive duration. This should not discourage the eventual spectator though : the richness of the work will easily make these small flaws pass.",8.0,10 February 2021
enjoyed this 7.5 but not 9 or 10,"S many 9 and 10 ratings. Crazy

It was a good movie.... but not a 10. 7.8

Nice story about a disfunctional family and how they get by

7.8",7.0,23 February 2019
I Can't Give This High Marks,,5.0,3 January 2019
When you choose your own family...!,"This other side of Japan story deals with shoplifters who got their own family. It is a very intriguing story, as it brings a lot of moral questions like - Who is mother? Who is family? What is kidnapping? The characters who are on other side of the legal system, have their own small life and family chosen by them. A very very interesting take on pre-conceived notions of the society. Must watch!!",9.0,11 August 2020
A masterpiece.,"The ghosts of Dickens, De Sica and Ozu hover over every frame of Hirokazu Koreeda's magnificent film ""Shoplifters"". This cross between ""Oliver Twist"" and ""Shoeshine"" but filmed in the style of Ozu's ""Ohayo"" is about a family of thieves in contemporary Tokyo who find a little, five-year-old girl abandoned by her abusive parents, take her in, shower her with affection and teach her to steal. They may be amoral and they may be lawbreakers but sometimes we find goodness in the strangest of places and in the least likely of people. What's worse, the film asks; stealing food and clothes or 'rescuing' a child, a crime society and the world at large views as the greater theft.

If the style of the film is neo-realist, the concept is purely humanist and, for once, Koreeda comes across as a Japanese Ken Loach and, like Loach, he draws extraordinarily naturalistic performances from his entire cast, (Miyu Sasuki, the little girl playing Yuri, is absolutely perfect), and there are great moments here, as good as any in recent cinema. Life, you see, is not black and white but full of all the colours of the rainbow if you just know where to look. Koreeda knows exactly where to look and this triumphant, beautiful and moving film is proof of that.",10.0,22 January 2020
"Koreeda And ""Family""",A truly humanitarian story and an exploration of the true meaning of family. And as always Koreeda filled the first two acts with heartwarming moments before hitting us with a shocking third act. Plus the film had a great work of editing and cinematography as well. A great watch,8.0,20 October 2020
Love is stronger than fate,"Shoplifters is such an amazingly beautiful movie. That it fills you up, with nitty gritty emotions.. that we start to believe in the goodness of life.",10.0,13 July 2019
Its power is undeniable,"Another film in the long list of amazing foreign films this past year, Shoplifters has an undeniable power that stings and leaves a mark.",,12 February 2019
Morally ambiguois,"Is taking a child away from what you think is an abusive parental home the the right thing to do even if it seems to improve that child's life? Is blood thicker than water and is this apparent 'kidnap' merely an extension of abuse? This is what this seemingly low-key and morally ambiguous Palm D'or winner challenges the viewer to address. If, like me, you get confused by family relationships - I have to think for a while to work out the difference between a stepson and a son-in-law for example - then you'll definitely need to keep switched on. But, despite the often complex 'familial' connections, the film never fails to deliver an honest and beautiful portrayal of humanity. Ken Loach would approve. 7.5 out of ten",7.0,28 November 2018
A fantastic movie,One of the best Japanese film ever. Script and direction is fantastic. Focusing in various tiny areas what is making the movie perfect.,9.0,11 June 2018
A very human and humble adventure,"This is a typical ""slice of life"" kind of drama, and it's very well done.

We follow a small family that struggles with poverty in a small house, and they are shoplifting. Suddenly they came by a street where they see a little girl which seems very sad, and her parents are yelling at each other. They decide to keep her for a while, they don't know for how long.

The characters are interesting and easy to identify to. What I really liked is that everyone in the family is helping in his own way, and you can see that despite the poverty they are very bound to each other. The little girl is slowly integrated to the family and she and her new sister start to have moral issues with shoplifting. The psychology is subtle and nicely thought.

The photography is really neat, we have a sense of depth in the composition, it's really clever and beautiful.

I also seen ""After the storm"" from Hirokazu Koreeda and I really like his cinema.

It's a bit long for me but it's a real dive into the middle-lower classes of Japanese culture. A beautiful family drama. I recommend.",7.0,2 March 2019
Beautiful creations of characters,"The cinematography and acting were top notch. The creator did an amazing job making you feel like you've known each character for years and making you feel for all of them. I love movies that make you think. When the screen faded to black with Yuri staring out at the city, it forces you to sit there and sort out all the thoughts you have about the movie.",8.0,14 September 2019
Mixed Feelings,,6.0,6 August 2020
couldn't get any slower,"The plot is moving boringly slowly.. A family of thieves.. Living in a shack out of grandmother's pension.. they receive money from relatives... most of them have jobs.. being a ""peep show girl"" is definitely not the best job, but still I couldn't figure out what does the family do with the money... Somehow I could not feel for them at all.. At least they saved a kid from abusive parents, but the movie is full of nonsense, the end making it even worse.. What was supposed to be the message here? Because I completely missed it...",2.0,2 March 2020
As human as it gets,"Honestly, I don't really know what to say other than that I loved this movie. Story was engaging and it stuck with me the whole day. Cinematograpy is outstanding and every detail is specific and magnificent. It is very touching and heartbreaking but it also speaks the truth. I think this could be 5 star on rewatch.",9.0,20 December 2019
