review_title,review_body,rating,review_date
Don't Ask just GO,"One of the best movie nowadays, be aware that this movie will teach you about the real meaning of love...Getting to know all the characters makes you more in love with All of them... Sakura Ando perfomance was unforgetable..and makes this movie more special than all the movies this days. Even quiet moments where so well made that you can connect with the characters by just looking their eyes. Some movies are important and even Epic....This movie Is not only a very good movie; it's pure beauty and Proof that you Don t need a movie with a lot of special effects...this movie shows what an Excellent script can do.",10.0,18 January 2019
A deep sense of what family means. Even without blood.,"This film explores the idea of what it means to be family to someone. It also explores propriety and boundaries. And how we could live with a totally different sense of boundaries. And it does this through the story of a few random people who through circumstances, begin to live together. And they're all shoplifters.",8.0,28 October 2018
Point A is bad in life that doesn't mean point B should be too,"Man o man, this was like the soothest experience I have ever got in recent times.

This is story of a made up family whose members aren't related with one another in a blood way but instead they chose their family, they are poor, always looking out for money, steal whatever they can but being all this all of them are such a beautiful should that you will have a hard time choosing which one to like.

Story, Acting & technicalities are way beyond imagination, go watch it guys & you will feel that too.",10.0,10 May 2021
Very good display of the reality of this Asian Class,"I resonated so much with this movie. I felt as if I was watching my ancestors life play right in front of me. The whole concept of being so active and close to a child, is what the current Asian cultures have lost because of culture changes. I feel the demographic that the world is revolved around, the internet, has caused a great social disruption on the health of family cultures and values in Asia. Asian families are being more distant and rebellious against their family, which causes a great strain on the culture, and the government as a whole. The people fo the Asian countries are still being put out there as a conformed cultured people, but the people are more disruptive than they have ever been in history. What is also so real about this movie is the experience that the movie allows you to have. The movie does a very good job at showing the struggles of the vast majority of the people in the Asian countries, but the movie does hide the reality of the more traumatic and the slum image of the people of the community that this movie is alluding too. It's understandable why they do this, and if you don't know, it's because it allows the government to have better control of these people, because then it allows the government to have a standard where this specific community can strive to accomplish. This community that these people are living I this movie, are more reputable than most people are in the country. These are more so around the lower middle class people in the Asian countries. Nonetheless the movie was great.",10.0,28 February 2019
Poignantly real,,8.0,9 May 2022
A study of a family,"A formed family , almost six family members . works out the understanding of life in the suburbs of Tokyo .",9.0,15 February 2019
Close up look into Choices and Family,"Do we choose our family or parents? Can't a person be a mother without giving birth? Shoplifter showcased the one possibility under our societal system. Story in general could have taken different turn still it would be same watching every version of it. Both child actors gave a good performance. Sakura Ando and Lily Franky moved to and fro from being normal to the label ""Not normal by shibata"".

A good movie to watch in cloudy day. It might evoke different feeling depending on the environment around you. That's how ""Shoplifters"" is.",8.0,26 June 2021
"""Quiet"", but also meaningful and emotional Japanese family drama","This is a great and emotional, although a bit sad drama about a family in which parents have part-time jobs that compel them to turn to shoplifting, who ""adopt"" a young girl, whose parents neglect her. We get to see the formers' everyday life, and finally realize they are more than just a family of shoplifters. Humanitarian director Hirokazu Koreeda manages to extract fantastic performances from the whole cast, and digs into the reasons why somebody would turn into shoplifting and generally illegal acts. The film itself neither excuses the family nor criticizes it. It just shows how hard is to be moral in an immoral world, and that sometimes truly unethical acts and people remain unpunished. We watch how companies and even the state could be responsible for the downfall and turn to crime of citizens (particularly the ones who live in poverty), as well. Concerning the more hopeful and enjoyable moments of the film, we observe the bond that's slowly created between the family and the young girl (and especially the young boy's efforts to bond with the new member of the family), how the adults (and the children) take care of young Yuri, and the more playful and intimate time the members of the family pass with each other. There are also valuable messages about what love is and how is this emotion expressed, and that even a family of outsiders can be loving. I recommend it as an introduction to Japanese cinema and also to the ones who want to see a touching but not schmaltzy family drama, without razzle-dazzle and exaggerated performances, that makes it to be deeply humanistic.",9.0,10 September 2023
Feels train,In the span if 2 minutes I went from laughing to crying. The movie is incredible! Loved having my heart manhandled like that.,10.0,7 July 2019
Great movie!,"I strongly recommend ""Shoplifters""... You can learn so much about human living from this simple relationships",10.0,3 March 2019
Actually quite enjoyable,"This film is a minimalist and intimate puzzle about the nature of family. The story revolves around a stripped down cast of characters with meager posessions. This serves a stylistic purpose, but it also removes distractions from a plot that chooses its words carefully and thus ensures that the story does not get lost in a web of ""stuff"".

While some reviews characterize the film, or just its ending, as sad, I did not find that to be the case. The ending is meditative, and ultimately leaves the viewer to consider a poignant but muted exchange between the Grandma and Nobuyo Shibata (played by Sakura Ando, who in my mind could have warranted an oscar nomination for this incredible performance). During a walk, Nobuyo muses that maybe the bond is more powerful if a former stranger chooses to be a member of a family. Hatsue (aka Grandma) responds that it ""will not last.""

I found myself reflecting on this conversation throughout the film and especially at the end. You can understand much of the two characters' behaviors through the lens with which they viewed family. In fact, much of the relationships in the film exist in pairings which to me pose this question over and over again and dissect the question from different but related angles: What is the meaning of family? Is it worth anything? Is it stronger if chosen? What is parenting? What do ""father"" and ""mother"" represent? How does one show love and intimacy?

These are powerful questions delicately posed and thoughtfully rendered. If the director felt there was a clear answer, he was not heavy handed in his execution. I think the ending is actually quite hopeful on this wider question, even if some of the individual characters' fortunes may seem a bit melancholy. These material setbacks, to me, seem less consequential, and one can savor the greater war that was won in demonstrating humanity's capacity to construct a deeply fulfilling bond by choice, even amidst scarcity and depravation. I found this quiet battle of flawed, unlikely soldiers quite inspiring indeed.",8.0,31 December 2021
Masterpiece,"Not enough words in the english language to describe this... Describes the family institution, society as an institution, and the consequences of these two in what we call their continuity.

The main idea that in a society, we should be able to choose our family many times explicitly expressed in this movie. This idea produces many other implications which can change the fabric of society. But in the real world, this is not the case. In the real world the above institutions reproduce themselves in a orderly and strict way and people pertain to this way of life because of the selfish gene which is very powerful in human beings...",10.0,23 February 2022
Shoplifters: A Heartwarming and Heartwrenching Tale of Family and Belonging,"In Shoplifters, we follow the daily struggles of the poor and unconventional Shibata family, who live in a cramped and rundown apartment in Tokyo. The family makes ends meet by engaging in petty crimes and scams, and they rely on each other for support and love.

One day, they come across a young girl who has been abandoned by her parents and is living on the streets. Despite their limited resources, the Shibatas decide to take her in and care for her, and they begin to form a close bond with her.

As the film progresses, we see the Shibatas struggle with their own personal issues and challenges, and we also see them come together as a family to support and protect each other. The film explores themes of family, love, and belonging in a way that is both heartwarming and heartwrenching, and it is a powerful exploration of the human condition.

The acting in Shoplifters is superb, with standout performances from the entire cast. The young girl, played by actress Sakura Ando, is particularly impressive, and the chemistry between the actors feels authentic and genuine. The cinematography is also excellent, with beautiful shots that perfectly capture the mood and tone of the film.

Overall, Shoplifters is a poignant and thought-provoking film that is not to be missed. It is a powerful exploration of family and the human condition, and it is also a moving and emotional story that will stay with you long after the credits roll. Highly recommended.",10.0,5 January 2023
lovely and touching movie about the meaning of family,"The story is touching and will grab your heart, and the acting is terrific. I was hooked on reading when my 2nd grade teacher gave me The Boxcar Children, and this movie is a modern Japanese version--about people who protect their humanity by living below the radar. Japanese film has a ""lower depths"" tradition, but this one is much warmer and more engaging than any previous movie about ""outsiders."" I remain puzzled by Aki's story--I missed something there--but it did not detract from the beauty of the movie as a whole. Just about perfect.",10.0,2 August 2020
Family! Secrets and loyality,"This movie asks various questions about the family, loyality, abuse, right and wrong. Does giving birth makes you a mother? Does the children get to choose their family. What constitutes a family? Blood or loyality? It makes you ponder about the unnoticed people in big cities, how they get going. The last scene of the the life of the two children changed forever by the love, care and everything they saw and learned from the family (not the blood one). Loyality above everything. Seems slow in middle but ending is good and raises a pretty big question.",8.0,7 April 2020
Family Dynamics,Study in Fringe family Dynamics and just eeking by in poor modern day Japan.,9.0,16 February 2019
Emotionally stunning.,"Gripping from the start and had my emotions all twisted by the end. A touching movie about the need for love and connection beyond social norms. Koreeda knocked this out of the park, each shot carefully crafted in a simple yet powerful way.",8.0,22 May 2022
Extended family,"Korean drama movies as well as their thrillers are really good. Well made but also really intriguing stories to boost the whole experience. In this case you have an extended family who as the english title suggests are into shoplifting. And while it was a bit strange to watch their routine when they were introduced, it quickly becomes clear that this is more than just about stealing.

Although there could be a pun in this. Especially considering how they find a new member of their family and how they get that member involved in their activities. Of course there is a lot happening and the relationships between the characters are quite something. This feels as real as possible (have not checked if certain things were based on real life but would make sense) to say the least. Great drama, great story",9.0,25 February 2021
"Raising and surviving, blooding and growing","If you don't have children, you can be a mother. Raising and surviving, most of the warmth, but the director himself with 20 minutes to tear the blood dripping, and with a chase to try to recover. Everyone acts, always bear the cause and effect, grow up on the road is always different. Outside the mainline, the cold law, which represents the upper class, is equally abhorrent.",8.0,18 February 2019
Fantabulous......,A must to see I love this film. I am not saying anymore or I would write about it for a week. Don't miss it.,9.0,16 March 2019
Did some weird hand gestures and then stole my heart,Very together movie. Information was dealt out very deliberately. The viewer was never given too much info and always had enough to understand what is happening. Some may prefer a tighter ending. Pretty good movie,9.0,9 January 2021
A bit slow but brilliant,I just wished for a better ending that didn't leave me in tears,8.0,1 March 2021
Not the Japan I'd imagined,"I absolutely loved this movie. It was unexpected and as it progressed, the movie and characters slowly evolved. Didn't know what to expect at the beginning but left having glimpsed another side of Japanese society. Wonderfully written.",9.0,3 February 2019
Watch out Roma--Shoplifters is lookikng at Oscar.,"Hatsue Shibata: I was sure she'd want to go home. Nobuyo Shibata: Do you think she... chose us? Hatsue Shibata: Usually you can't choose your own parents. Nobuyo Shibata: But then, maybe it's stronger when you choose them yourself.

After these demanding holidays, consider what ""family"" means. Regardless of your definition, Hirokazu Kore-eda' s Shoplifters will help define at least ""extended family."" This Japanese dramedy defines love as a central ingredient of family, despite the fragmented, sometimes tumultuous, little world of adults and kids occupying a small Japanese-style hoe, where most of what you see strewn around has been stolen from unsuspecting merchants and naifs prone to believing grifters.

Despite the formal nature of the film, romance is tucked away in heretofore unsuspecting corners such as everyone's love for and dependence on a 'Grandma"" (Kirin Kiki), like others in this family not blood related but bound by affection and needs to be fulfilled through the small community. After Grandma's support, the other major source of funds appears to be outright shoplifting, facility by children savvy and innocent enough to win our hearts and never lose them.

Is this story funny? Yes. Is it eventually tragic? Yes. Do we love the characters anyway? Yes. Will this small film, winner of the Cannes' Palm d'Or, give jitters to the accepted foreign language Oscar competitors Roma and Burning? Yes. Should you see it with your family and expand your understanding of what family means? A resounding Yes!",,5 January 2019
watch out Pixar,In busyness of tear extraction there is a new name. OMG its impossible not to get eyes running watching this. That little girl is amazing. They tried to make movie lighthearted but it is still soul wrenching.,8.0,22 January 2021
"Fascinating film about...family? Well, yeah.","What makes a family? What does one teach the children? What do people do to survive? Maybe they should do -something other- than what they've chosen but as they say, you make your choices and you usually get the life you deserve.

I sat, spellbound, for the entire length of the film and, even though some of the characters are pretty sketchy (in terms of morality), you find yourself rooting for them. So the script, cast, and director all grab your attention and you wish for a happy ending. Maybe you get one. I won't say. Go watch the film.",8.0,15 March 2019
Good movie with a bad ending!,,8.0,10 August 2021
A Gem of a Movie,What is Right or Wrong Does what you see is the truth Right intentions and deeds will make you feel better but what is it the best thing for the person to whom you are trying to be nice or helpful. See the movie.,10.0,21 July 2019
A personal and nuanced film asking questions without easy answers,"Shoplifters deserves all the hype it's gotten as one of the strong, smart films of 2018. It's a slow burn that seems to just be a simple portrait of a family, but then really opens your eyes in the last half hour and forces you to reexamine your beliefs about the characters. Some scenes seem isolated or not adding anything to the overall plot, but the more I mull the film over, the more I see small connections between scenes and the need to develop the characters as Kore-eda did. The last half hour of the film is shocking and exciting, and at the heart of it all is the question: what makes a family? Kore-eda doesn't give us a single simple, one-dimensional character - each is fascinating and flawed in realistic ways. I am still wrestling with the morality of the ""family""'s actions. They were caring to the kids and perhaps did their best living on the fringes of society, and it's very hard to not sympathize with them. On the other hand, you do see the manipulative side of them come out on numerous occasions. Shota is a fascinating character as someone who clearly cares deeply for the family but also becomes uneasy with the morality of their stealing, and eventually it's too much for him. The themes and ideas will stay with me for a while, and I only wish more people would watch this movie and engage with it, because it does not disappoint.",8.0,6 May 2019
a not so traditional family,,8.0,25 February 2019
I'm not your dad,,9.0,4 January 2023
"Other than eating noises, everything is lovable about this movie","This movie asks a lot of interesting questions, like what is a family? Is doing sonething against what community consider wrong is always a bad thing, even in good intentions? And the film doesn't give u a straight answer, you'll have to figure it out yourself. As for the cinematic elements, everything was ery good, amazing script, good directing and cinematography, and acting was very real and believable. It's a slow paced movie, so it's not for everyone, but i really did enjoy it myself (i just didn't enjoy the eating scenes :D) 8/10",8.0,16 March 2019
this was hard stuff,"Im not well aquainted with japanese film, and does not understand the language, and do know very little about japanese life and culture other than what i learnt at school and through the news. im sure this does not represent the typical japanese lifestyle, but there are most probably some who could resemble with the people living in this group.

the film play on all strings of human emotions, and was at times hard to watch. the acting are at times overwhelming, especially by the mum and dad in this den of thieves. its like a modern version of oliver twist by charles dickens, where children are molested,thrown away,unloved, making other grown ups to take advantage and carrying on like pseudoparents.

the filmatic impression are very good, it tells a great part of the story with good colors and very nice glow in the lightsettings., i could not find any glitch in the editing,and the pace and length of the film are perfect.

as im not related to the japanese language i miss alot of the depth in the dialouges, but the cc's were good. to summarize it i can say that its not a comedy, more an overall survival drama , and i guess this film is quite revolutionary in its kind in japanese cinemas. its a guess from the grumpy old man that had a good time watching manbiki kazoku.highly recommended",9.0,12 February 2019
Forged by Circumstance: Society's Unlikely Family,"""Shoplifters"" is a captivating and thought-provoking film that explores the complexities of families and the unexpected bonds that can emerge from unlikely circumstances. It talks about a non-traditional family living on the fringes of society, challenging societal norms and shedding light on the complexities of love and belonging.

The performances in ""Shoplifters"" are exceptional, especially the lead actress, with every actor bringing a depth of emotion and authenticity to their roles. The chemistry among the ensemble cast is palpable, capturing the intimacy and genuine connections that form within the non-traditional family. Their performances anchor the film, imbuing it with a sense of realism and empathy that allows the audience to fully invest in their lives and struggles.

The film's final revelation, exposing the family's darker nature, serves as a powerful twist that adds depth to the overall narrative. It prompts reflection on the nature of human behavior and the complexities of familial relationships. While unsettling, this ending offers a thought-provoking conclusion that lingers in the mind long after the credits roll.

It shines a light on the power of love and compassion in redefining the notion of family. While it tackles a controversial subject matter, it does so with sensitivity and a deep exploration of human connections. ""Shoplifters"" is a must-watch that will leave you contemplating the essence of family and the universal desire for human connection.",8.0,26 May 2023
Heart Lifters!,"""The Shoplifters"" should have stolen the Oscars, but I knew that it wouldn't have worked out well due to the existence of CCTV.",10.0,12 November 2020
Shoplifters,"A genuinely super film about a family of small time chancers who survive on their wits on the verge of poverty. There is something almost Fagin-esque about their behaviour, but in best Robin Hood tradition we always feel that their small-scale criminal activities are carried out as a result of necessity than from any need or wish to do anyone else any harm. They take in a little girl off the street which stretches their already meagre resources but without rancour or complaint and we skip through a series of events, some beautifully poignant some rather more serious. The contrast between the three generations of the ""Shibata"" family living in a space no bigger than an average garage compared with some of the wealth and Japanese opulence surrounding them is expertly delivered by a strong cast - especially the youngsters - under the careful direction of Hirozaku Koreeda - and makes for a thought-provoking two hours of cinema.",8.0,30 May 2024
The way of living is rich and the way of living is poor,"Or they may be intervened by a third party, or they may not be favored by their parents, or they may be dismissed, or their parents may not even want to give birth to Ta... These abandoned people together form the warmest, most harmonious, most harmonious, and most lovely family. They are either unemployed, injured at work, or rely on theft to make a living, or work in a customs shop. They live at the bottom of society, lacking material wealth, but their spiritual life is incredibly fulfilling. They each have no blood relationship with each other, but everyone lives happier than their original family. Marriage does not necessarily mean happiness, being abandoned by a husband can also lead to a family full of children and grandchildren; Having a child does not necessarily mean being a mother, and even if one lacks fertility, maternal love can be given. Why can't Shibata Jiichi teach a child, but he has taught him what adolescence is. Yaji stayed away from a wealthy family because Mr. 4's shoulders made her feel warmer. Yuri was abused by her biological parents, but a stranger was willing to protect her at the cost of losing her job. The way of living is rich and the way of living is poor. We live a decadent life in abundance, and they feel boundless love amidst poverty.",9.0,14 March 2024
The unusual family,A family which seems normal from outside but has deep dark secrets in it. This films sums it all up.,8.0,16 February 2019
Another great Japanese production,A lovely movie. So much is happening in this movie. It is heart warming and really worth watching 100%. There are a lot of complicated emotional aspects in this film and it just keeps on evolving. It's wonderful to watch.,9.0,6 August 2022
Absolutely wonderful movie,"Which doesn't have any outlandish elements, but shows life and social services just how they are in many countries, and particularly in Japan with all the Japanese peculiarities of keeping so much to themselves, people just ignore those living on the margins, for worse, and also for the better.

It is a loving and critical portrait of the Japanese society and a situation which is quite common in it, this movie does everything right about the, that the modern French movies do wrong about the French society. And - it's not an autobiographical story, so there's hope in some screenwriters being capable of writing good stories.",9.0,3 November 2023
