review_title,review_body,rating,review_date
"A journey inside a dysfunctional family, with a dramatic twist.","""Shoplifters"" portrays a dysfunctional family that tries to survive, despite their difficult financial situation. The adults are teaching the kids how to shoplift, in order to get food. It is very obvious that the parents do not really want to improve their living conditions in any way. We discover later on that they committed some heinous crimes and their behavior is despicable. However, the director was able to show that these people also have a good side and they love every single member of this unconventional family in the same way. This is one of those movies that made me think a lot and it put me in front of many ethical dilemmas. I love when filmmakers portray real issues in front of a camera and make the audience waver. The general mood tends to be light-hearted, but the movie exposes several important and complex topics related to Japanese society.

The cast was good, I have to praise the job done by Sakura Andô, Lily Frank and Kirin Kiki, who were able to express in a convincing way many different emotions. Overall the acting is very natural, and this is what made this film great: it felt very close to reality. I enjoyed the photography, which is simple and yet interesting. The plot is amazing and there is a very dark and unexpected twist. Some elements of the plot tend to be a bit dragged: at times I wondered if the film would finally move on. Cutting down a few scenes would make it a bit more digestible. For sure it is a flick that takes its own time to properly develop the characters, therefore if you are into slow burners, this might be a nice treat.",7.0,27 July 2022
Family Life,"Like Oshima's 'Boy', Kore'eda's film quietly portrays the cramped existence of it's family at the bottom of Japan's heap with the same bright colours and careful framing - and lively performances by the children - as late Ozu.

Matter-of-factly depicting shoplifting as a way of life for those left behind in modern Japan (which goes about it's daily business around them) the record it provides of which will in sixty years time make it as diverting a piece of social history as Ozu's films are today.",8.0,16 December 2020
Good but flawed,"I'm glad this film exists, the performance's from the kids are brilliant, the first hour promise's something really special.. but, it falls short from being brilliant - the story doesn't quite add up, the ending feels rushed and a bit anime, also they should have got some pointers from real shoplifters.",6.0,16 August 2019
First movie we ever left cause just too boring to make it to the end.,,4.0,9 February 2019
It Sneaks Up on you and Steals your Heart,A family of shoplifters help each other make sense of a cruel world and we begin to question if we really know the difference between right and wrong. Lily Franky fuels the film with a playful optimism that distracts us from the family's struggle while Sakura Andô keeps us grounded and protects us like only a mother can. The subtle beauty and genuine heartache of this film will stick with me for years to come.,10.0,31 January 2019
subtle and brilliant,"This movie is fantastic. This film is so well acted and directed... it is rare to find a movie so subtle and so human. Moreover, it plays with our expectation very well. The ""a family with a dark secret"" have been overdone in world cinema... however, in this movie, it is brilliant. My favorite film of 2018.",9.0,9 May 2019
"Well-crafted, humane, and human","It takes a while to process this very compelling, and somewhat disturbing film that zooms in, almost anthropoligically, on the bizarre ""family"" life of a group of lost souls on the margins of Japanese society. And it took me a night's sleep to even try to articulate what the movie is really about.

The acting is great, particularly by the children, who were clearly superbly directed and mentored. ""Shoplifters"" sometimes feels like a documentary, as it reveals the daily life of three generations of aimless people brought together by randomness and fate, but have a bond that is inexplicable but heartfelt. The movie casts a neutral light on this group without judgment or service to a predictable narrative arc. Still, it holds your interest, goes by quickly, and has a surprising finish that is both honest and shocking.

The directing, cinematography, and score are all first-rate. To sum up: If you like the cinema you will want to see the ""Shoplifters,"" but it's more of a journey in humanism than a jolly night out at the movies.",10.0,23 December 2018
Review - Manbiki kasoku,"Some of the best child performances that I have seen recently, you almost the impression that they aren't acting.

The relationships between are well explored and nuanced by the director, Hirokazu Koreeda, and not a single minute of the runtime is wasted on unnecessary character motivation explanation, the smart directing can make you deduce by yourself what is going on on the mind of the protagonists

A truly well-deserved Palme-d'Or, shocking that this movie didn't get more recognition in the Occident.",8.0,20 June 2020
Thought-provoking and Insightful,"The way the movie is paced slowly connects you to the family and their bond with each other. In spite of their poverty, they function so well as a family. Even when they shoplift, it doesn't feel greedy. They are just doing everything they can to survive. They learnt to find joy in the little things and displaying love without conditions or expectations. The movie also shows the flaw in the justice system in listening and understanding people in abusive situations and easily condemn an action. In the end, the most precious thing in building a relationship are not fancy material things but time, understanding and the way they treat each other.",7.0,1 May 2023
"An breath-taking display of realism, a lesson in empathy and an exploration of the meaning of family conveyed in 120 minutes.","This was the first movie by the Japanese director Hiorkazu Koreeda that I've seen, and I was blown away. Koreeda, like his earlier works, continues his exploration of the true meaning of family in Shoplifters. This is breathtaking movie evokes so many emotions in the audiences and it does it so well, that its very hard not to connect to the Shibata Family. This is the second international movie this year I have seen about the repressed and the poor trying to live their lives, the first being Parasite. And it goes without saying, if you loved that one, then you'll love this one even more as Shoplifters is definitely more realistic and more powerful as a story.

Shoplifters focusses on marginalized people existing on the fringes of Japanese society who barely eke out a living by engaging in activities that skirt the letter of the law. It is the story of flawed people who have patched together a working ""family"" of outcasts who believe that the impulse to survive and create a nurturing environment is more important than strict adherence to society's norms and blood relations.

The film opens in a supermarket where Osamu Shibata (Lily Franky), a middle-aged, part-time construction worker, is seen exchanging strange hand signals with a pre-teenage boy, Shota (Jyo Kairi), who seems to regard what is going on as a family outing. It quickly becomes apparent that this is no ordinary family shopping spree but an exercise in shoplifting, as we watch Shota casually throw items from the shelves into his shopping bag when no one is looking. Justifying their flouting of the law, Osamu says that if the goods are in the store, it means that they do not belong to anyone, and tells Shota that they are stealing the items only as a means of helping the family. Much later when questioned about stealing by the authorities, sadly he says that shoplifting was the only skill he had to teach the boy.

Osamu, as it is gradually revealed, is the part of a household consisting of himself and wife Noboyu Shibata (Sakura Ando), wife's teenaged sister (but from a different mother) Aki Shibata (Mayu Matsuoka), Osamu and Noboyu's young son Shota, and grandma Hatsue Shibata (the late Kirin Kiki), all living in a small, cluttered apartment outside of Tokyo, scattered with toys and knick-knacks everywhere, barely providing the family with enough room to eat and sleep.

This warm but abnormal family is slowly revealed to be conjoined in ways we did not expect. The catalyst for this is dad and son bringing home a neglected 5-year-old girl, by the name of Yuri (Miyu Sasaki), they come across abandoned on an apartment balcony on a freezing winter night. The girl comes home with them, and slots into the family, a pattern, we slowly realize, that has been repeated in the past. Granny was 'picked up,' and the son seems to have arrived by similar means. Their warmth and humanity is at odds with the illegality and disregard for social mores. Society judges such people, but by allowing us intimacy with them, Koreeda shows how society is also judged by them - and found wanting.

Shoplifters for its most part is focused on this families daily life and the problems they face emphasizing on their bonds, their empathy and their poverty. The slow revelation of the family's background, the naturalistic interactions, the judicious spacing of shocks and surprises, are all evidence of a master filmmaker in perfect sync with his material. Throughout the entire film, Koreeda does not stand in judgement of his characters but simple observes the trajectory of their life. Even when he moves into darker territory in the film's last section, its main focus remains on the humanity of the characters. When Noboyu disposes of an item that is a painful reminder for Yuri about the family that abused her, she gives her a big hug, explaining that when people love each other, they give them hugs and do not hit them. In an exquisite moment, Yuri places her hand on Noboyu's face who lets it remain there for a few minutes. These are flawed individuals and Koreeda does not avert a critical gaze from their individual responsibility.

While Shoplifters contains elements that are painful to watch, what we take with us is Koreeda's empathy displayed in the beauty of small moments: The joy of trips to the beach and coming of age for Shota and Osamu handling it so humorously, the sharing of cold noodles on a humid summer day and the long repressed sexual intimacy that follows between partners, the expression on the faces of young children aware, perhaps for the first time, that they are loved; and the entire family listening to, but not seeing, a firework display (what a metaphor for this family's peripheral status!).

The real joy comes from the way the whole thing gels and shimmers, and provides steely insight on contemporary Japanese society, and the human condition. This sense of realism and joy in small moments of life of its characters is communicated with simple gestures like the slurping sounds of noodles as the family eats dinner together, the way they follow small cultural beliefs and give the young girl Yuri salt to lick before bed so she doesn't wet the bed in the night, or the way Grandma hits a small metallic cup in honor of her dead husband every morning and Aki introduces Yuri to her new hair and name sitting in front of the mirror. It is through such small scenes that we can see clearly, that poverty is everywhere, but you don't need money or be related by blood to be a family.

The cinematography is extraordinary, with some surprising long shots, close-ups and beautiful shots from tight angles. The editing is speechless, connecting numerous scenes just seamlessly. Not a single minute is wasted, and the film is largely intense and arresting. Together with the brilliant performances from the ensemble cast, the result is a satisfying and deeply affecting drama on lower class in Japan.

The performances are sublime and it's more of a team effort as every character completes another and ultimately form an arc that tells the story in a brilliant way. Franky Lily and Kirin Kiki both are tonally perfect here. Koreeda shows that he has a deft touch with child actors. The maturity in the performance of both the child actors, Jyo Kairi and Miyu Sasaki is stunning. Sakura Ando is outstanding as the mother-figure, made wise by her bitter experiences but also upbeat in her approach to life. Her threat to kill a minor character is chilling. One scene, where she performs straight to camera, answering a question on what her 'children' called her, rips your heart out.

Overall in a breath taking display of realism, Shoplifters tells a touching story that's seemingly simple at first sight but gets nuances to a point but the film sticks to its realism and dismantles the social norms with such grace, offering a new insight to a world unknown to most, where people long for family love and they're desperate to have someone to call family, on account of the raw emotions it conveys. The film explores big questions on living a good life and taking responsibility in an uncaring society. Shoplifters is a rare exercise of social realism and it gets its message across so elegantly making it filmmaking at its finest.

Shoplifters is a simply stunning film and must watch for all.",9.0,8 July 2020
A movie of intricacies,"In life the things that stand out are the episodic or the most lifechanging moments. Thus do we cherish or hate the change. We get to see a family who appear to have little in means yet give, of the little they have.

They help a seemingly abused small girl and this girls big change begins here. However, they all have a new additional member to get used to. This is the first phase the accustomization phase the change or changes that will effect them all. The second one is the cherish,joy and happy phase. The third phase i will not spoil.

Within a little time we somewhat understand the storyline but it is the small intricacies that intrigues and when all the small pieces come together one realises the depth of the storyline that becomes more than initially anticipated. A renewed sympathy and respect to the characters unfold within oneself. Yet with some doubt as to their prior intention, but clearly understanding their intention at this point in time. A nice mellow movie that shows how people can be a positive or negative influence and focusing on the good even when dealt a bad hand. How being good to others makes you good and not being a force of evil is the best way to act.",7.0,10 January 2020
A perfect film about a warm family in a cold society,"Koreeda, often compared with Yasujiro Ozu, in this film adopts a sort of Loach like view of the world. He treats it with the light touch of ""Raining stones"" (1993) and not with the heavy anger of ""I, Daniel Blake"" (2016). He does it perfectly.",8.0,18 August 2019
Good but not for everyone,"It's good because of the way a family is portrayed even though they're not a ""conventional"" family. The performance of the kids were great, especially the boy. The reason it's not for everyone and the reason I didn't rate it an 8 is the pace, the movie feels slow and at 2 hours quite long, although the flip side is you do develop a bond with and deeper understanding of the characters.",7.0,13 February 2019
Dissapointed,"I had high hopes for ShopLifter, given its insanely high reviews, but unfortunately, it fell flat for me. Even though the movie has some good aspects like the way it's filmed and directed, I can't figure out why it looks like it's from the 1990s when it was made in 2018. Is there a reason for this choice other than just how it looks?

People seem to really like this movie, but I don't understand what they see in it to give it such high ratings. Despite being 3/4 of the way through, the movie felt boring and didn't hold my attention. I typically enjoy dramatic films, but this one just didn't click with me, and I felt like I wasted my time watching it.

The lack of music in the movie also made it feel strange and uncomfortable. The absence of a soundtrack left a void that affected the overall experience.

If you're like me and prefer movies that are easy to watch without delving into deep meanings, I'd suggest skipping this movie. Some people compare it to the popular Korean film Parasite, but in my opinion, Parasite is far superior. Im sure to be in the minority here, but this movie just didn't click with me.",4.0,6 August 2023
"Watch this film, you'll be rewarded","I found it riveting, but without highs and lows or melodrama. It steals your soul as effortlessly as the ""family"" in the film steals crisps from the local convenience store.",10.0,28 April 2019
"Gosh, I almost got through without mentioning the many scenes of slurping noodles - hot and cold!","The dreaded word, 'heartwarming' is the most likely to be dragged out to summarise this but it would be unfair. Director Hirokazu Koreeda is much more interested in dissecting the true meaning of 'family' than pulling at the heart strings and producing sentimental tosh. Clearly a labour of love (and concern) he produces amazingly naturalistic performances out of a varied group of actors. It is also clear that Lily Franky has become a Japanese favourite despite the only other film I have seen of his, which was his first, the 2001 low budget semi-disgrace that was Blind Beast vs Dwarf! Mind you he was probably the only good actor in that and he is perfect here as the father (figure). Those brackets are important and even more so in relation to the 'mother' and 'grandmother' seen here as some sort of modern day saviours (or villains according to the police and accepted standards of morality). Mention must be made of the incredible performance of Miyu Sasaki who looks no more than four or five. Again, I assume we must look to the director as to just how such a remarkable performance was achieved. Apart from the serious question of 'real' mothers and what is best for children this film will be an eye-opener for those who know little of Japan or have just visited on a controlled tour. Here is the gritty underbelly, sex workers, day workers, pachinko parlours and seven elevens in all their tawdry glory. Plus a sample of the delightful weather, thunderstorms, snow storms and insufferable heat. But it is not all bad and without resorting to using the 'h' word I would say that this does paint a picture of a people dedicated to helping each other where possible and contriving to live under the most crowded of conditions. Gosh, I almost got through without mentioning the many scenes of slurping noodles - hot and cold! Minimal story but masterful direction of this (very) close knit family is bound to hold your attention.",8.0,11 December 2018
"A poignant, deeply affecting and thought provoking","Shoplifters is a beautiful movie about what it truly means to be a family. The central theme being that the bonds we forge is thicker than what is thrust upon us. It's the kind of 'slice of life' which makes you wonder about your own life. It's poignant, it's beautiful, it's deeply affecting and it stayed with me long after.",9.0,22 February 2019
A Superior Experience the Second Time Around,"Shoplifters was a superior experience the second time around. I was able to understand the family dynamics much better and the story made much more sense. For whatever reason, the food scenes did not annoy me as much and I felt much more emotion.

Key moments include the rekindling of the relationship between Nobuyo and Osamu, the saving of Yuri from abusive parents, the building of a snowman and the beach scene (no, not the one from Roma haha).

I still have an issue with Aki's subplot as a sex worker. It just felt really out of place and kind of random. It takes up about five minutes of the film, and it really kind of makes the feel out of focus. If that part was removed, the film would easily be a 4.5/5 (9/10).

With a wonderful score, detailed set designs, amazing acting from all of the cast, and a beautiful story about the true meaning of family, Shoplifters is a great film, even if I disagree with it winning the Palm d'Or!",,14 December 2018
Sensitive and beautiful until the last act - spoliers,,7.0,7 July 2019
"Superb, heartbreaking, honest, pure.",,10.0,15 September 2019
Emotional ride,"A very understated movie, with a story that leaves you thinking about it for a while even after the credits roll. This is due mainly to some great performances (although I do feel a bit of the lines and performances is lost in translation), with the child actors really standing out. The pacing is slow but deliberate, creeping along leaving you enough time to really take the story in. Other highlights are some nice and memorable set pieces and poignant photography. The story ends up being a bit too complicated to follow while watching but seems worth the follow up. Could have been more compact but definitely worth a watch.

7.5",7.0,25 August 2019
Superb production... Excellent...,"I like these oriental films very much, set in the lower classes, here we see a family living in a cubicle, as in many communities in Brazil, the strong point of the plot, in addition to the impeccable script, are the dialogues, natural, spontaneous, as if they had been filmed within the family, very captivating, and family relationships are plastic amidst so much poverty and social inequality... What an intriguing, shocking ending, so much wrong in the world, a slap in the face. Superb production...",10.0,23 August 2021
The meaning of the family,You will see what make family is more than birth relationship it's love,7.0,9 May 2019
Captivating view of Japanese poverty,"Visuals: 7 The movie captured the mood and atmosphere of the plot

Soundtrack: 8 The sounds complemented the movie in a good way

Plot: 8 It is a very slow build up and it does not seem like there is any consistent plot but I felt like I was constanly captivated by the ""family""'s lives. Interesting view of Japan that is not very common.

Characters, acting and dialog: 9 All characters were beleivable and relatable in some ways. The acting was superb.

Total: 8",8.0,24 January 2021
Thought provoking from beginning to end.,"A beautiful and powerful film that leaves you sad and angry at the same time. I would put it up there with my favourites; Cuckoo's Nest, Paris Texas and The Road Home for the range of emotions evoked and that exhausted feeling as the end titles role. Every aspect of the film makers art is superbly portrayed in every frame; the acting, lighting, photography and direction were all superb: it is one of those films where every frame would make a stunning photograph. Without giving anything away I would just say that when it comes to the ""family"", it's not your genes or the blood in your veins, it's your spirit and the love in your heart.",10.0,24 July 2020
Amazingly Beautiful and Heartbreaking Story of the Resilience of Children.,"Some songs you want play over and over, poems hear over and over, and some films view over and over. Shoplifters is a gift from the heart. If you were ever a child and wondered what the next day held, this is the film for you. Beautifully told adventure that is artfully reined in by the realities of society. Love and sacrifice really can mean a lot of different things depending on where or who it's coming from.",10.0,9 April 2021
A must-watch masterpiece.,"Without spoiling anything, I'll say that even in the most long and normal scenes I didn't feel even a slight of boredom. One of the most heart warming and beautiful films. You can see the beauty of film making in the simplest of shots. The fact that this was one of the last films for the late actress Kirin Kiki makes it much more emotional for me. Thank you for all your hard work, Kirin Kiki and may you rest in peace.",10.0,4 April 2019
You should hug that you love,,,30 September 2020
Getting by the best you can even if it's illegal and still love and family is most important.,"Finally saw the international and foreign language film ""Shoplifters"" the 2018 Japanese hit about a family who lives on the edge of society and must get by the best way they can. Story is simple a family with many problems both social and economic wise who live on the margins of Tokyo, are simply a band of outsiders and rebel like renegades who all unite and love and work together by shoplifting just to get by and eat and make ends meet. As each know how to con and play the game of life. However things change when the family takes in a child from out in the cold, and more matters are complicated when their young son is arrested and caught which brings plenty to the airwaves. Overall okay film it's a test of will and loyalty proving that family and love is made of stone and can survive.",7.0,19 March 2019
